104.00	20141101	Hermann Traub	Offenbarung 15,5-8	Offb 15,5-8	Keine Angst vor Gottes Gericht	Wichtig ist: die Zornesschalen sind zeitlich befristete Plagen, Schrecknisse undEreignisse. Sie gehen ausvonGott, "der da lebt vonEwigkeit zu Ewigkeit". Und wer heute und zu seiner Lebenszeit mit diesem ewigen Gott in Beziehung tritt, der braucht vor Zornesschalen und den dazugehörigen Gerichten keine Angst zu haben. Gerichtet werden auch nur die, die sich vorher dem Satansdienst verschrieben haben, die "sein Tier" angebetet haben (Offb 16,2). Gottes Strafe für Götzendienst ist nicht abzuwenden. Diesen Gedanken greift Paulus in Römer 1 auf. Dort wird die ganze gottlose Lebenspraxis als Götzendienst bezeichnet. Wer die Gebote Gottes, seine Lebensanweisungen missachtet, der fällt unter das Gericht Gottes. Wer das von Gott Geschaffene anbetet und nicht ihn, der wird dem Gericht preisgegeben. Dazu gehört auch jede Lebensweise, die Gottes Schöpfung widerspricht. Götzenanbetung (Stars sind moderne Götzen), praktizierte Homosexualität, Geldgier und viele andere Abweichungen von Gottes Geboten werden hier genannt. Gott lässt sich nicht spotten. Er zieht alle zur Rechenschaft, die sich nicht versöhnen lassen mit ihm. Deshalb gilt die Einladung: Kehr um, vertraue dich Jesus an! Er allein kann dich aus jedem Götzendienst befreien.			Lernt, Gutes zu tun! Sorgt für das Recht! Helft den Unterdrückten! Verschafft den Waisen Recht, tretet ein für die Witwen!	Jesaja 1,17
81	20141102	von Sina Rittsteiger	Psalm 139	Ps 139	Ein Psalm für unser ganzes Leben	Er kennt dich durch und durch - diese Zusage formuliert der Psalmdichter David. Verbunden mit dieser Aussage ist die allumfassende Wirklichkeit Gottes. Er kennt dich und weiß um alles, sogar um die Dinge, die du selbst (noch) nicht weißt und verstanden hast. Für manchen mag dies wie eine Drohung klingen, denn an keinem Ort in oder außerhalb dieser Welt könnten wir uns vor Gott verstecken, er ist überall bei uns. David hat dies verstanden und in eindrucksvolle Verse verpackt. Anstatt Angst, Sorge oder Scham darüber zu haben, was Gott denn von ihm denken könnte, bekennt er Gott alle seine Gedanken und Gefühle. Es lohnt sich, diesen Psalm einmal genau zu analysieren und herauszufinden, was alles in ihm steckt: Lob, Anbetung, Dank, Bitte, Klage, Freude, Leid, Hass und Bekenntnis - alles hat David untergebracht. Hoffentlich erinnert uns das an unser eigenes Leben und unsere Gottesbeziehung. Vielleicht kann der Psalm eine Erinnerung an uns werden, wieder alles und nicht nur die Sonnen-oder Schattenseiten unseres Lebens vor Gott hinzulegen. Er will uns und unser Leben ganz, mit allen Höhen, Tiefen und alltäglichen Kleinigkeiten. Vor ihm, der unser Leben erdacht und geschaffen hat, können und müssen wir sowieso nichts verbergen.	Es ist dir gesagt, Mensch, was gut ist und was der Herr von dir fordert, nämlich Gottes Wort halten und Liebe üben und demütig sein vor deinem Gott.	Micha 6,8		
104.01	20141103	Sina Rittsteiger	Offenbarung 16,1-9	Offb 16,1-9	Das Bild von Gott bestimmt das Handeln	Gott stellt sich den ungläubigen Menschen anders vor, als den, den sie vielleicht so oft als den "lieben Gott" abgetan haben, ohne sich jemals wirklich an ihn zu wenden. Die ersten vier der Schalen seines Zorns werden nun von den Engeln ausgeleert und damit eine Zerstörung eingeleitet, die für uns kaum vorstellbar ist. Passt hier noch die Aussage des Engels und des Thrones "gerecht und heilig" (V. 5.7)? Können wir hier einen Gott erkennen, der gerechte Strafen verhängt? Ja und noch viel mehr nimmt uns Vers 6 die Last der Rache (vgl. Röm 12,19-21) - Gott selbst vollzieht sie an den Verfolgern von Glaube und Gläubigen, dabei begegnet uns aber kein unkontrollierter Jähzorn. Noch viel mehr begegnet uns Gott als ein mächtiger Gott (V. 8 f.), der sich nur eines zu wünschen scheint: dass die ungläubigen Menschen erkennen, dass sie die falschen Götzen anbeten und dass sich die Umkehr zu ihm lohnt. Während sie nur weiter verfluchen, dürfen wir ihn als den anbeten, der gerecht, heilig und mächtig ist. Auch heute schon erkannt zu haben, wen es sich lohnt anzubeten (V. 2), versetzt mich wieder neu in Ehrfurcht vor seiner Größe und nimmt mir die Angst vor seinem Zorn.				
104.01	20141104	Sina Rittsteiger	Offenbarung 16,10-16	Offb 16,10-16	Wie lange müssen wir noch warten?	Viele Geschichten und Mythen ranken sich um Harmagedon und den dort stattfindenden Kampf. Während wir im Text erst einmal nur erfahren, wie es zu diesem Ereignis kommen wird, wird dem Leser seine Grausamkeit vor Augen geführt. Die Nähe zum Alten Testament, dem Auszug aus Ägypten, den Plagen u.v.m. wird in Bildern deutlich gemacht, die die ersten Leser in Schaudern versetzten. Ein Ort, der bereits Schauplatz mehrerer Kämpfe war (Ri 4 und 7), Könige, die mit ihren Armeen zum Kampf ziehen (unzählige Male mussten die Israeliten andere Völker fürchten), und dazu böse Geister, deren Aussehen unreinen (und somit verachtenswerten) Tieren gleicht (3. Mose 11,10 f.). Mittendrin die ungläubigen Menschen, die unter Schmerzen und Geschwüren leiden. Dabei wird leider wieder eines deutlich: Selbst die größte Qual kann keinen Menschen zur Umkehr zwingen. Gott wünscht sich die freiwillige Hinwendung zu ihm. Das geschilderte Übel muss uns nicht verzweifeln lassen, aber beinhaltet die Anweisung "wachsam" zu sein. Egal ob wir morgen oder in tausend Jahren mit der Schlacht rechnen, müssen wir uns heute schon diese Frage stellen: Wie sieht diese Wachsamkeit in meinem Leben praktisch aus? (vgl. Mt 25,1-13)				
104.01	20141105	Sina Rittsteiger	Offenbarung 16,17-21	Offb 16,17-21	Alles vorbei?!	Die letzte Schale wird ausgegossen und die letzte Plage eingeleitet. Der Kampf befindet sich gerade in seiner ersten Stunde und ist dabei gleichzeitig das Ende einer langen Vorgeschichte. Nun wird für alle Zeiten mit Babylon abgerechnet, der Zorn Gottes wird ihr in einem Weinbecher gereicht, an dem die Stadt sich berauschen kann. Nicht nur die Stadt und die Menschen erleiden Qualen, auch die Erde verändert sich durch den Einfluss von Naturgewalten. Begegnen uns hier verdiente Weltuntergangsszenarien? Ein Teil der Menschen verflucht Gott weiterhin und auch bei den Städten gibt es Unterschiede. Während die große Stadt zu ihrem Vorteil hin zerfällt (vermutlich ist Jerusalem gemeint; vgl. Sach 14,1-8), werden die Städte der Heiden, allen voran Babylon, endgültig zerstört. Diese Städte vereinen alles Böse, z.B. die Abkehr von Gott in sich und ihre Zerstörung wurde schon lange angekündigt (Jes 13,6-13). Welche Hoffnung schenkt uns die Errichtung des neuen Jerusalems für alle Gläubigen? Eine neue Stadt, in der Angst, Hass, Gewalt und Gottlosigkeit keine Macht mehr über die Menschen haben. Ein wahrlich "himmlisches Zuhause" für uns, in dem das Leben erst noch einmal so richtig anfängt.				
104.01	20141106	Sina Rittsteiger	Offenbarung 17,1-6	Offb 17,1-6	Der Einfluss der Macht	Johannes bekommt die Hure gezeigt, die auf ihrem Tier sitzt. Sie zu sehen versetzt ihn in einen Zustand von Erschrecken und Entsetzen, obwohl sie von Aussehen und Kleidung her wie eine wahre Königin beschrieben wird (V. 4). Der Glanz einer prächtigen Herrscherin wird durch den Inhalt ihres Bechers und dem Namen auf ihrer Stirn getrübt. Alles, was Gott verhöhnt und abweist, was ihm die Ehre nimmt, die ihm als dem heiligen und allmächtigen Gott gebührt, vereint sich in Wein und Name. Ihre eigentliche Gefahr und Größe zeigt sich vor allem in ihrem Einfluss auf die Menschen, der über die ganze Erde verbreitet ist (V. 1). Sie wird als Mutter und Urheberin alles Widergöttlichen beschrieben, betrunken vom Blut derer, die für ihren Glauben an Christus gestorben sind. Für die Mächtigen und Könige war sie kein Grund für Angst, sondern eine Verbündete, die sie berauscht und verführt zu haben scheint. Auch heute schon finden wir in unserer Welt und Kultur Ideen, Aussagen, Dinge, Events und Menschen, die toll aussehen, dabei aber Gott und seinen Namen lächerlich machen und in den Dreck ziehen. Wo begegnet dir solche "Verhöhnung" Gottes? Wann musstest du selbst schon einmal darunter leiden, Christ zu sein?				
104.01	20141107	Sina Rittsteiger	Offenbarung 17,7-14	Offb 17,7-14	Hast du's kapiert?	"Hier ist Weisheit von Gott gefragt" (V. 9)! - Diese Aussage des Engels gilt für die ganze Offenbarung. Nur Gott weiß, wie es am Ende sein wird und was die Bilder und Geschehnisse genau bedeuten. Gottes Weisheit und Verstand lassen uns wenigstens teilweise verstehen, was wir lesen, aber gleichzeitig zeigen sie deutlich, dass es uns z.B. nicht weiterbringt darüber zu spekulieren, wer die Könige sein werden (oder waren), deren Herrschaft das Ende einläuten. Wichtig ist hingegen die Tatsache, dass diese ihre Kraft in den Dienst des Tieres stellen werden. Gar nicht so einfach immer zu durchblicken, in wessen Macht Herrscher handeln, aber genau aus diesem Grund haben wir als Christen den Heiligen Geist und die Bibel bekommen, um zu verstehen, was Gottes Willen gemäß ist und wer oder was nicht. Einer Sache dürfen wir uns aber gewiss sein: wenn wir auf der Seite des Lammes stehen, sind wir auf der Gewinnerseite. Was für den Verstand unlogisch erscheint - ein Lamm, das als Sieger hervorgehen wird -, wird für uns zum Lebensretter und Garant der Ewigkeit. So geht es auch heute schon vielen Menschen, wenn sie hören, dass Jesus am Kreuz für ihre Sünden gestorben ist. Was nicht logisch klingt, ist unsere Kraft (vgl. 1. Kor 1,18).				
104.01	20141108	Sina Rittsteiger	Offenbarung 17,15-18	Offb 17,15-18	Vertrauen auf das, was Bestand hat	Die Lästerung Gottes nimmt eine dramatische Wende: das System beginnt sich selbst zu zerstören. Die Hure, gerade noch angebetetes Verbindungsglied der gottlosen Machthaber und aller Ablehnung Gottes, wird nun von ihnen selbst vernichtet. Gott wirkt dieses Szenario, indem er den Königen diesen Gedanken eingibt (V. 17). Er bleibt in Kontrolle und dabei vor allem seinen Ankündigungen treu bzw. führt alles ans Ziel (vgl. Jes 46,10). All das zeugt von seiner Vertrauenswürdigkeit, die ganz anders ist als unsere menschlich oft so übliche Unentschlossenheit und das selbst erkämpfte Recht, sich nicht festlegen zu wollen. Es ermutigt zu wissen, dass er Herr über allem ist und bleibt und seine Worte auf ewig Bestand haben. Noch viel mehr beruhigt es zu wissen, dass diese Zuverlässigkeit eben nicht nur für alle Drohungen, sondern auch für alle seine Zusagen gilt, die wir in der Bibel finden. In allem Chaos der Zerstörung behält Gott den Überblick und seine Pläne gehen weiter, wie unser eigener Verstand, der oft keine Ordnung hineinbringen kann. Das gilt auch schon heute in deinem Leben, wenn du Gott Herr sein lässt. In Zeiten von Leid und Sorgen ist er da und du darfst ihn bitten einzugreifen und Durchblick und Ausweg zu zeigen.				
48	20141109	Holger Noack	Psalm 75	Ps 75	Der Richter	Wenn alles wankt, worauf können wir uns verlassen? Wenn Menschen hochmütig und selbstsüchtig ihre Macht herausstellen? Wenn sie diejenigen, die sich an Gottes Willen halten, verächtlich machen? Wenn es leichter scheint, ohne Gott sein Leben zu führen, anstatt ihm zu vertrauen? Dann gilt: "Gott ist Richter" (V. 8a). Er hat es in der Hand, denjenigen, der sich selbst erhöht, zu erniedrigen, und den, der erniedrigt wird, zu erhöhen (V. 8b). Gott weist die Hochmütigen zurecht: "Rühmt euch nicht so" (V. 5)! Und er fährt den Gottlosen über den Mund: "Pocht nicht auf Gewalt" (V. 6)! Noch scheinen die Hochmütigen und Gottlosen die Macht zu haben, den eigenen Willen durchzusetzen und die Gottesfürchtigen an den Rand zu drängen. Doch Gott lässt sich das Heft nicht aus der Hand nehmen: "Wenn meine Zeit gekommen ist, werde ich recht richten" (V. 3). Und wenn wir zutiefst verunsichert sind, weil unsere Welt aus der Balance geraten ist, so wissen wir, dass Gott alles wieder ins Lot bringen wird (V. 4). Seine Gerechtigkeit wird diese Welt erneuern und erhalten. Das ist schon jetzt ein guter Grund, Gott zu loben, und das, was er für uns getan hat, seine Wunder, weiterzutragen und weiterzusagen (V. 2).	Siehe, jetzt ist die Zeit der Gnade, siehe, jetzt ist der Tag des Heils!	2. Korinther 6,2b		
104.02	20141110	Holger Noack	Offenbarung 18,1-24	Offb 18,1-24	Der Untergang	Nur noch rauchende Trümmer: alles, was von der großen, reichen, verführerischen Stadt Babylon übrig geblieben ist. Das Zentrum der Gottlosigkeit der Welt ist zerstört. Man kann es kaum glauben, wie schnell es geschehen ist: "In einer Stunde ist sie verwüstet!", klagen ihre früheren Gönner und Handelspartner (V. 19). Sie hat die Völker dazu verführt, Gott den Rücken zu kehren und sich anderen Mächten zuzuwenden (V. 3). Sie hat sich sicher gefühlt, unangreifbar, selbstbewusst. Durch ihre vielen Kontakte war sie reich und mächtig geworden, sodass sie sogar wagte, Gott herauszufordern. "Es geht auch ohne Gott - und es lebt sich besser, weil ausschweifender", war ihr Leitgedanke. Doch ihre Gottlosigkeit trägt nicht. Ihre Macht ist kein Schutz. Ihr Reichtum ist keine Garantie für eine glänzende Zukunft. Ein einprägsames Bild: Die Gottlosigkeit zerstört sich selbst und reißt andere mit in ihr Unheil. Gottes Gericht lässt sich nicht aufhalten. Und so setzt sich die Erkenntnis durch: "Stark ist Gott, der Herr, der sie richtet" (V. 8). Der Untergang Babylons macht deutlich: Die Gottlosigkeit wird gerichtet, damit die Welt gerettet wird.				
104.02	20141111	Holger Noack	Offenbarung 19,1-10	Offb 19,1-10	Die Hochzeit	Das Ende Babylons ist der Beginn des Hochzeitsmahls des Lammes. Babylon, das Zentrum der Gottlosigkeit in dieser Welt, ist vernichtet - jetzt beginnt etwas Neues: "Denn der Herr, unser Gott, der Allmächtige, hat das Reich eingenommen" (V. 6)! Gott herrscht und das gibt der Welt ein anderes Gesicht: Nicht mehr der Kampf, sondern das Fest bestimmt diese Welt. Das Gute, Gottes Wille, muss sich nicht mehr durchsetzen, indem es das Böse besiegt. Jetzt wird gefeiert, dass Gott diese Welt mit sich versöhnt hat: "Lasst uns freuen und fröhlich sein und ihm die Ehre geben" (V. 7). Eine Stimmung wie bei einer Hochzeit: freudig, erwartungsvoll, glücklich. Das Lamm, in der Offenbarung der Bevollmächtigte Gottes (Offb 5,6 ff.), durch den Gott auch in den Wirren der Endzeit die Macht behalten hat, verbindet sich mit der Braut, der Gemeinde Jesu Christi (Offb 21,1.9). Gott ist nicht fern, sondern mitten unter uns. Wir gehören zu ihm, wie Braut und Bräutigam zueinander gehören. Es ist eine Ehre, zu diesem Hochzeitsmahl eingeladen zu sein: "Selig sind, die zum Hochzeitsmahl des Lammes berufen sind" (V. 9). Eingeladen ist jeder, der Gott vertraut und der Gott die Ehre gibt, die ihm zusteht.				
104.02	20141112	Holger Noack	Offenbarung 19,11-21	Offb 19,11-21	Der Anführer	Die Entscheidungsschlacht naht: Das Tier, der Repräsentant der widergöttlichen Mächte, und seine königlichen Parteigänger haben gegen Gott und die Seinen mobilgemacht (V. 19). Angeführt wird das Heer Gottes von einem Kämpfer auf einem weißen Pferd (V. 11.19). Wer ist das, der sich der geballten Macht des Bösen entgegenstellt? Er trägt vier Namen, die ihn charakterisieren. Sein erster Name: "Treu und wahrhaftig" (V. 11), denn er wird die Aufgabe, die Gott ihm übertragen hat, sorgfältig und gewissenhaft erfüllen. Er steht in Gottes Diensten und vollstreckt den Willen Gottes. Seinen zweiten Namen kennt er nur selbst (V. 12), denn er ist unabhängig von anderen, nicht manipulierbar, unbestechlich. Keiner kennt diesen Teil seiner Persönlichkeit. Nur er selbst. Er ist frei. Sein dritter Name ist: "Das Wort Gottes" (V. 13). Er ist Gottes Wort und Wille in Person. Was Gott sagt, das führt er aus. Sein Wirken ist Gottes Botschaft an diese Welt: Das Böse wird besiegt - Gott wird herrschen! Deshalb sein vierter Name: "König aller Könige und Herr aller Herren" (V. 16). Die Macht Gottes in dieser Welt ist in ihm präsent. Im Namen Gottes wird er herrschen und seine Macht hat keine Grenzen.				
104.02	20141113	Holger Noack	Offenbarung 20,1-10	Offb 20,1-10	Die Entscheidung	Noch einmal steht das Böse auf und spielt seine Macht über die Herzen der Menschen aus (V. 7). Noch einmal gelingt es dem Teufel, die Menschen zu verführen und gegen Gott aufzuhetzen. Er bringt es fertig, "das Heerlager der Heiligen und die geliebte Stadt", Jerusalem, zu umzingeln und zu bedrohen (V. 9). Als hätten die Menschen nicht zuvor andere Erfahrungen mit Gott gemacht: tausend Jahre war der "Drache, die alte Schlange, das ist der Teufel und der Satan" (V. 2) von der Erde verbannt. Die Menschen waren frei von allen Einflüsterungen der Gottlosigkeit. Das Leben konnte sich entfalten. Gerechtigkeit herrschte. Diejenigen, die um ihres Glaubens willen verfolgt und getötet worden waren, wurden von Gott rehabilitiert (V. 4). Eine Welt, in der die Menschen die Abwesenheit des zerstörerischen Bösen und zugleich den Segen Gottes erfahren haben. Aber kaum ist der Teufel frei, gewinnt er wieder an Macht über die Menschen. Deshalb greift Gott selbst ein. Feuer, das vom Himmel fällt, ist ein Bild für die vernichtende Macht Gottes über das Böse. So wie Feuer alles, was brennt, verzehrt, so wird Gott auch das Böse endgültig beseitigen. Gott vernichtet, was das Leben vernichten will, den Teufel (V. 10) und den Tod (V. 15). Das Leben bleibt!				
104.02	20141114	Holger Noack	Offenbarung 20,11-15	Offb 20,11-15	Das Gericht	Vom Ende wird recht nüchtern berichtet: Akten werden geöffnet (V. 12a), die Zugangsberechtigung zu Gott wird geprüft (V. 12b), ein Urteil wird gesprochen (V. 13) und anschließend vollstreckt (V. 14 f.). Das Gericht am Ende der Zeiten dient nicht der Rache für das Unrecht, das die gottlosen Mächte über die Welt verbreitet haben, sondern dient der Gerechtigkeit: Gott stellt die äußere wie die innere Ordnung der Welt wieder her. Die Welt ist aus den Fugen geraten, je mehr die Gottlosigkeit überhandnahm. Je mehr die Menschen sich von Gott abwandten, desto mehr verfielen sie der Gier nach Leben, der Maßlosigkeit, schließlich der Gewalt gegeneinander. Der Tod richtete sein "Reich" in dieser Welt auf: die Macht des Todes, die alles in dieser Welt in Mitleidenschaft zieht und es letztlich zerstört. Deswegen ist Gottes Gericht am Ende der Zeiten ein Gericht über den Tod und sein Reich. Dessen Macht muss gebrochen werden, damit das Leben bleibt. Und darum fällt Gott das Todesurteil - über den Tod (V. 14). Der letzte und stärkste Feind des Lebens ist besiegt und gerichtet. Gottes Gerechtigkeit hat gesiegt - und mit ihr das Leben.				
104.02	20141115	Holger Noack	Offenbarung 21,1-8	Offb 21,1-8	Die neue Stadt	Beeindruckend. Ehrfurcht gebietend. Strahlend schön. Johannes ist fasziniert von der Stadt, die aus dem Himmel herabkommt. Das neue Jerusalem ist ein Ort der Sicherheit, des Friedens und des Lebens. Sicherheit, denn "das Meer ist nicht mehr" (V. 1). In der Bildsprache der Bibel ist das Meer der Einfallsort des zerstörerischen Chaos in die Schöpfung. Dieses Einfallstor ist beseitigt. Die Schöpfung wird nicht mehr zerstört werden können. Frieden, denn "Gott wird abwischen alle Tränen von ihren Augen" (V. 4). Eine sanfte, zärtliche Geste. Die Vergänglichkeit, die unser irdisches Leben selbstverständlich und unerbittlich prägt, ist von Gott weggewischt. Der Tod hat keinen Raum in der ewigen Stadt Gottes. Leben, denn Gott spricht: "Ich will dem Durstigen geben von der Quelle des lebendigen Wassers umsonst" (V. 6). Leben für alle. Umsonst. Wie Wasser aus einer frischen, unerschöpflichen Quelle. Niemand, der in dieser Stadt wohnt, ist vom Leben abgeschnitten. Und im Zentrum dieser heiligen Stadt thront Gott. Er ist der Mittelpunkt. "Siehe, ich mache alles neu!" (V. 5) ist der Leitsatz seiner Herrschaft. Nicht das Alte, Vergängliche, sondern das Neue, Ewige bestimmt das neue Jerusalem.				
35	20141116	Thomas Käßner	Psalm 50	Ps 50	Ein Gottesdienst, der ankommt	Der Gottesdienst ist zum Problemfall geworden. Es gibt Streit darüber, wie ein richtiger Gottesdienst aussehen muss. Singt man aus dem Liederbuch oder soll es eine Powerpointpräsentation sein? Ist die Predigt eher ein Referat über Lebensfragen oder wird ein Bibeltext ausgelegt? Spielt die Band oder werden je nach Tradition Orgel, Klavier oder Harmonium bevorzugt? Mit Psalm 50 mischt sich Gott in diese Debatte ein - ungefragt, wie sich aus den Zeilen entnehmen lässt. Denn in Vers 5 muss er seine Gemeinde erst mal zu sich rufen. Da möchte man fragen, wo sie denn bis jetzt waren. Die Antwort ist erschütternd. Sie waren im Gottesdienst - und doch nur bei sich selbst. Mit Opfern haben sie nicht gespart, um Gottes Gunst zu erkaufen. Doch Gott ist auf solche Geschenke nicht angewiesen. Als Schöpfer der Welt kennt er keinen Mangel. Auch lässt er sich nicht bestechen und übersieht nicht, dass im Alltag seine Gebote mit Füßen getreten werden. Was gehört denn nun zwingend zu einem guten Gottesdienst? Gott für seine Güte zu danken und ihn für seine Gaben zu preisen, ihm die Not zu klagen und zu halten, was man ihm versprochen hat. Das sind Inhalte eines Gottesdienstes, die bei Gott ankommen. Wenn das klar ist, sollte man sich über Stilfragen einigen können.	Wir müssen alle offenbar werden vor dem Richterstuhl Christi.	2. Korinther 5,10		
104.03	20141117	Thomas Käßner	Offenbarung 21,9-14	Offb 21,9-14	Be-gründete Hoffnung	Als ich Kind war, sollten wir im Zeichenunterricht malen, wie wir uns die Zukunft vorstellen. Damals war der Glaube an den technischen Fortschritt noch ungetrübt. Und so malten wir unter anderem riesige Hochhäuser, wo auf dem Dach jeder einen Parkplatz für seinen eigenen Hubschrauber hatte. Die Menschen waren glücklich und jung, denn gegen jede Krankheit und sogar gegen das Altern gab es ein Mittel. Heute ist von diesen Illusionen nichts geblieben. Warum aber sollten die Zukunftsaussichten der Offenbarung glaubhafter sein? Was spricht dafür, dass es wirklich eine Zeit geben wird, in der Gemeinde und Jesus wie ein verliebtes Brautpaar in ungetrübter Freude zusammenleben werden? Diese Hoffnung ist be-gründet, denn sie hat Grund und Fundament im Zeugnis der Apostel, die Jesus gesehen und gehört haben. Diese Hoffnung ist sicher, weil sie abgesichert ist durch die zwölf Stammväter Israels, die Gott zu seinem Volk erwählt hat. Die Zeugnisse der Apostel finden wir im Neuen Testament, die Lebenserfahrungen der zweiten Gruppe im Alten Testament. Letzten Endes ist also Gottes Wort der Garant der Zukunft und nicht die Sehnsüchte und Illusionen von Menschen. Deshalb ist diese Hoffnung begründet.				
104.03	20141118	Thomas Käßner	Offenbarung 21,15-21	Offb 21,15-21	Glänzende Aussichten	Wie stellen sich Menschen den Himmel vor? Manche meinen, wir würden dann als Engel auf einer Wolke sitzen, eine Harfe in der Hand halten und ewig Halleluja singen. Mal ehrlich, wer möchte da schon in den Himmel? Was Johannes über die Welt Gottes zu sagen hat, übertrifft jegliche Vorstellungskraft. Vor unserem Auge entsteht eine Stadt von 2.200 Kilometern Länge, Breite und Höhe. Dagegen ist jede unserer Großstädte ein jämmerlicher Marktflecken. Selbst der größte Berg unserer Erde verschwindet darin mehr als 240 Mal. Der Kubus (Würfel) galt in der Antike als der perfekte Raum. Und genau das will Johannes uns damit sagen: Gottes Welt wird ein perfekter und unvorstellbar großer Raum sein. Mehr noch, er wird auch unvorstellbar herrlich sein. Das zeigen die unterschiedlichen Edelsteine, aus denen die Wände bestehen. Der Liederdichter Paul Gerhardt hatte unseren Bibeltext vor Augen, als er 1653 dichtete: "Ach, denk ich, bist du hier so schön und lässt du's uns so lieblich gehn auf dieser armen Erden: was will doch wohl nach dieser Welt dort in dem reichen Himmelszelt und güldnen Schlosse werden?" Soviel steht fest: Gottes neue Welt wird nicht langweiliger sein als die, in der wir jetzt leben!				
104.03	20141119	Thomas Käßner	Offenbarung 21,22-27	Offb 21,22-27	Der entscheidende Unterschied	An Versuchen, unsere Welt besser zu machen, hat es in der Geschichte wahrlich nicht gefehlt. Mit Bildung versuchten es die Aufklärer. Die Kommunisten setzten auf Klasse (Arbeiter und Bauern), die Nationalsozialisten auf Rasse (der deutsche Herrenmensch). Besser ist die Welt aber nicht geworden. Im Gegenteil! Wie viel Leid und Elend haben insbesondere die beiden Diktaturen des letzten Jahrhunderts über die Menschheit gebracht? Was ist dabei falsch gelaufen? Gott blieb in ihrem Denken außen vor. Deshalb mussten alle diese Versuche scheitern. In der neuen Welt Gottes wird Gott alles in allem sein. Deshalb gibt es keinen Tempel mehr. Gott "wohnt" nicht nur in einer Nische, sondern erfüllt alles. Das ist das Entscheidende an der Ewigkeit. Dass es eine unvorstellbar heile Welt geben wird, mit viel Licht und ohne Schatten, funktioniert nur, weil Gottes Ehre alles bestimmt und kein Mensch sie ihm mehr streitig macht. Der heutige Buß-und Bettag ist auch für Christen Anlass, Gott um Vergebung zu bitten, wo wir seine Ehre durch unser Leben mit Füßen getreten haben. Wo Gott die Ehre gegeben wird, beginnt heute schon ein Stück Himmel.				
