95.08	20150831	Klaus Forschner	Matthäus 13,53-58	Mt 13,53-58	Wer ist denn der?	Wer ist denn der, dem Wind und Wellen gehorchen, der Kranke gesund und Tote lebendig macht? So könnte man sich fragen. Ganz nebenbei erfahren wir hier einiges über den Menschen Jesus, neben seiner Mutter und dem Vater, der Zimmermann war, bekommen wir die Information, dass er vier Brüder und Schwestern hat. Insgesamt wissen wir wenig über Jesus im Blick auf seine Familie. Es ist kaum von Bedeutung im Blick auf die Frage, wer dieser Jesus ist. Wie beurteilen wir andere? Da spielt die Herkunft oft schon eine Rolle, die Frage nach den Freunden und vielleicht nach dem Bildungsabschluss, der ja auch etwas über die sozialen Bezüge der Person aussagt, oft bestimmt das unsere Meinung über eine Person. Hier bei Jesus ist es fast dramatisch: Die soziale Herkunft - vielleicht seine Identität - ist mit den Wundertaten Jesu nicht zusammenzubekommen. Wer ist denn der? Wie passt das alles zu ihm? Also eigentlich passt dieser Jesus nicht in das Bild von dem, was man vom Messias erwartet! Jesus zieht sich zurück. Wegen des Unglaubens der Leute in seiner Heimatstadt Nazareth tut Jesus dort keine oder nur wenige Wunder. Nur der Glaube kann die Zeichen und Wunder, die Jesus tut, richtig deuten. Wer ist denn dieser Jesus für mich?				
95.08	20150901	Klaus Forschner	Matthäus 14,1-12	Mt 14,1-12	Wer ist denn der?	Diese Frage wiederholt sich in diesem Text im Prinzip noch einmal: Wer ist dieser Jesus? Die Leute hören viel von ihm, sogar der Landesfürst Herodes stellt sie sich. Ist Jesus womöglich der wiedergekommene Johannes der Täufer? Mit einem Blick in die Geschichte - und Matthäus gewährt ihn uns - erfahren wir, welche Erlebnisse Herodes mit Johannes dem Täufer hat. Vermutlich war die Beziehung zwischen Herodes und Johannes zwiespältig: Einerseits wollte er ihn töten lassen, andererseits wollte er ihm nichts Böses. Er hat ihn ins Gefängnis setzen lassen, wo es ihm eigentlich ganz gut ging. Seine Jünger hatten immerhin freien Zutritt ins Gefängnis zu ihrem Meister. Aber Johannes war ein unangenehmer Bursche: Herodes hatte die Frau seines Bruders zu sich geholt und seine eigentliche Frau verstoßen. Das prangerte Johannes sehr deutlich an. Vor allem dieser zweiten Frau, Herodias, war Johannes mit seinem klaren Urteil ein Dorn im Auge. Sie nutzte die Gelegenheit, Johannes töten zu lassen. Jetzt kam wieder so einer, der die Wahrheit schonungslos aufdeckte: Jesus! Wurde das schlechte Gewissen des Herodes wach? Auf jeden Fall stellte sich erneut die Frage: Wer ist dieser Jesus? Was hat er mit Johannes zu tun? Beide sind Botschafter Gottes!			Wenn ihr nicht umkehrt und werdet wie die Kinder, so werdet ihr nicht ins Himmelreich kommen.	Matthäus 18,3 
95.08	20150902	Klaus Forschner	Matthäus 14,13-21	Mt 14,13-21	Wer ist Jesus - wer sind wir durch ihn?	Wie es Jesus öfter getan hat, will er sich zurückziehen in die Stille, allein sein, sicher mit Gott, seinem Vater. Aber die Menschen gönnen es ihm nicht, sie brauchen ihn, sie suchen ihn, seine Worte und Taten. Jesus nimmt die Bedürfnisse der Menschen wahr, auch hier: Sie jammern ihn, mit dem, was sie brauchen. Er redet vom Reich Gottes zu ihnen und hilft ihnen, indem er Kranke heilt. Während die Menschen so mit Jesus zusammen sind, vergessen sie, was sie auch noch brauchen. Die Jünger sind aufmerksam. Sie weisen Jesus darauf hin. „Gebt ihr ihnen zu essen!“ ist im Angesicht der vielen Menschen eine unerfüllbare Aufforderung. Aber indem Jesus bei Gott den Dank ausspricht und seine Leute in ihre Verantwortung nimmt, geschieht das Wunderbare! Das Wenige, das da ist, reicht. Die Jünger sollen geben, was sie haben. Das ist ihr Auftrag bis heute! Wir werden mit unserem Wenigen im Reich Gottes Großes bewegen, manchmal ganz unauffällig und unspektakulär. Jesus will bis heute seine Jünger in eine neue Dimension des Glaubens hineinnehmen, er will sie beteiligen an der Durchführung seiner Wunder. Geben wir ihm dazu Raum?				
95.08	20150903	Klaus Forschner	Matthäus 14,22-36	Mt 14,22-36	Auf Jesus schauen	Nun endlich kommt Jesus zu seiner Stille. Er schickt die Leute weg und lässt auch die Jünger allein ihres Weges ziehen. Wusste er, was auf sie zukommt? Wollte er sie vorbereiten auf die Zeit ohne seine körperliche Gegenwart? Wir wissen es nicht. Die Jünger kommen ins Durcheinander des Lebens und sind hilflos. Auch jetzt ist er ihnen so nah wie beim Wunder der Speisung der 5000. Sie sehen ihn aber nicht. Anscheinend begegnet ihnen Jesus auf eine für sie bislang unbekannte Weise und sie können ihn nur als Gespenst einordnen. Nur wenige Stunden nach dem überwältigenden Wunder schreien die Jünger vor Angst. Petrus macht ganz neue Erfahrungen, sein starker Glaube kommt ins Wanken, für ihn körperlich spürbar. Wenn es Jesus ist, dann muss ich das auch können, wie er auf dem Wasser zu gehen, denkt Petrus. Doch sobald er auf sich selbst und die äußeren Umstände starrt, beginnt er zu sinken. Das war eine notwendige Lektion für Petrus: „Petrus, schau nur auf Jesus, schau nicht auf dich selbst, den Wind und das Meer!“ Nicht nach dem Brotwunder, sondern nach der Rettung aus der Todesangst erkennt Petrus: Du bist wahrhaftig Gottes Sohn!				
95.08	20150904	Klaus Forschner	Matthäus 15,1-20	Mt 15,1-20	Was bedeuten den Jüngern die Gebote?	Nachdem die Jünger erfahren haben, dass es auf den einfachen Glauben ankommt, muss es nun fast zwangsläufig zur Auseinandersetzung mit den Gelehrten gehen: Es geht um die Satzungen und wie sie gehalten werden können. Die theologisch liberalen Sadduzäer sind im Streit mit den Pharisäern, die die Gebote und Gesetze der Bibel (AT) streng beachten und mündliche Überlieferungen und Auslegungen hinzunehmen, um ganz sicher zu gehen. Gerade die Reinheits- und Sabbatvorschriften spielen hier eine große Rolle. Was macht unrein? Heute eher eine Frage der Hygiene, war dies zur Zeit Jesu eine Frage des Glaubens. Hier gehören sehr stark die Bereiche des Alltags wie das Berühren und das Essen dazu. Jesus weckt mal wieder auf: Ihr macht euch Gedanken über Äußerliches, was man essen und berühren kann. Es geht doch aber um das Innere, um das Herz: Denn aus dem Herzen kommen die bösen Gedanken, Mord ... - das sind die Dinge, die den Menschen unrein machen. Darum möchte Jesus das Herz der Menschen gewinnen. Erneuerung geschieht von innen. Was aus dem Mund herauskommt, das macht unrein. Das, was wir zu anderen sagen, kann uns oder andere zerstören. Darauf will Jesus den Blick lenken und auf das, was uns das Herz (er-)füllt!				
95.08	20150905	Klaus Forschner	Matthäus 15,21-28	Mt 15,21-28	Großer Glaube	Das ist ungewöhnlich: Jesus weist jemanden ab, der etwas von ihm will. Drei Gräben tun sich für die kanaanäische Frau auf: 1. Jesus schweigt und lässt die Frau mit ihrer Bitte auflaufen. 2. Seine Jünger fordern ihn auf: Schick sie weg, sie stört! 3. Jesus erklärt: Ich bin nur gekommen zu den verlorenen Schafen des Hauses Israel. Obwohl sie ihn als den Messias angesprochen hat („du Sohn Davids“, V.22), hat die Frau anscheinend keine Chance. Sie weiß aber wohl, dass der Messias kommt, um Menschen in der Kraft Gottes zu heilen. Warum sollte er es an ihrem Kind nicht auch tun, das seine Hilfe so dringend brauchte? Das Nein Jesu lässt die Frau nicht gelten. Sie bittet noch einmal: Herr, hilf mir! Jesus antwortet mit Prinzipien, während die Frau mit ihrer Not kommt! Sie antwortet klug, aber vor allem gibt sie nicht auf. Sie erwartet Hilfe, die ihr vielleicht nicht zusteht, aber doch um der Barmherzigkeit willen zufallen soll. Jetzt handelt Jesus: Frau, dein Glaube ist groß! Dir geschehe, wie du willst (V.28). Der Glaube entscheidet, nicht die Herkunft! Das bedingungslose Zutrauen der Frau, ihr hartnäckiges Festhalten an dem Heil, das durch Jesus auch zu ihr kommt: Gottes Heil gilt allen! Glaube inmitten von Widerständen!				
49	20150906	Rolf Trauernicht	Psalm 78,1-31	Ps 78,1-31	Wenn Väter den Glauben vermitteln	Dieser Psalm mahnt die Zuhörer, die Taten Gottes nicht zu vergessen und sie den Nachkommen zu vermitteln. Vers 4 und 5: „Gott gebot unseren Vätern, ihren Kindern seine Macht und Wunder zu lehren.“ Das ist umso wichtiger, als der Psalmdichter Asaf feststellt, dass das Volk Israel weitgehend Gott vergessen hat und in Sünde gefallen ist. Wenn es uns wichtig ist, dass unsere Nachkommen Gott und sein Wort ernst nehmen, müssen wir es ihnen vermitteln. Viele Menschen unserer Zeit haben kaum die Möglichkeit, in ihren Elternhäusern, Schulen und Kirchen das Wort Gottes kennenzulernen. Das Bibelwissen ist in unserer Gesellschaft, aber auch Gemeinden erschreckend gering. Das können wir fördern, indem wir eine besondere Konzentration auf die Kinder- und Jungschararbeit in unseren Gemeinden legen oder Religionslehrer werden oder sie unterstützen. Vor allem Eltern oder Großeltern sollten ihren Nachkommen immer wieder die Geschichten der Bibel erzählen. Eine Kinderbibel stellt dabei ein gutes Geschenk für Kinder zu Weihnachten oder anderen Feiertagen dar. Vergessen wir dabei nicht, dass den Vätern in dem Psalm eine besondere Aufgabe zukommt. Kindergottesdienste sollten auch von Männern durchgeführt werden.	Lobe den Herrn, meine Seele, und vergiss nicht, was er dir Gutes getan hat.	Psalm 103,2		
95.09	20150907	Rolf Trauernicht	Matthäus 15,29-39	Mt 15,29-39	Jesus sieht unsere Bedürfnisse	Indem Jesus viele Wunder vollbrachte, erfüllte er viele Prophetien über seine Person. Damit machte er allen deutlich, dass er der Messias ist. Die Krönung der Wundergeschichten ist nun die Speisung der Viertausend. Was lernen wir heute: An Jesus sehen wir, dass er den Hunger wahrnimmt und handelt, obwohl ihn keiner darum bittet. Wir haben es mit dem gleichen Jesus zu tun, der längst weiß, was wir bedürfen. Matthäus 6,8 bestätigt das: „Denn euer Vater weiß, was ihr bedürft, bevor ihr ihn bittet.“ Parallelen dazu sind 2. Könige 4,38-44; 1. Könige 17,1-23. Das gilt auch für unsere heutigen Bedürfnisse. An den Jüngern sehen wir, dass sie sich hilflos gegenüber der Masse der Menschen vorkamen und ein Wunder gar nicht in Aussicht stellten. Es ist zwar tröstlich, dass die Jünger so reagierten, wie wir es wahrscheinlich auch tun würden. Aber wir sollten daraus lernen, dass Jesus immer noch einen Ausweg sieht, wenn wir keinen sehen. Noch etwas ist wichtig: Das Wunder geschieht, indem die Nahrung, die vorhanden war, eingesetzt wird. So kann unser Herr aus dem wenigen, was wir an Zeit, Kraft, Worte oder Geld geben, viel machen. Das hält uns demütig und abhängig zugleich.				
95.09	20150908	Rolf Trauernicht	Matthäus 16,1-12	Mt 16,1-12	Den Pharisäer in uns entdecken	Die Pharisäer mit ihren vielen zusätzlichen Regeln, die keiner einhalten konnte, und die Sadduzäer, die nicht an die Auferstehung der Toten glaubten, kommen in der Bibel meistens schlecht weg. Sie hatten sich verrannt in ihre Sonderlehren. Jesus erkannte ihre Motive und Auswirkungen. Die Jünger durchschauten das nicht. Sie konnten den Bezug nicht herstellen zwischen den Lehraussagen der Pharisäer und Sadduzäer und deren Auswirkung: Mit ihren Sonderlehren verführten sie ein ganzes Volk. Sie waren weit von Gott entfernt und nicht mehr offen für die Wahrheit. Sonderlehren in Richtung gesetzlich oder liberal gibt es heute auch noch zahlreich und vielleicht sogar um uns oder in uns. Wir haben laut 2. Korinther 4,7 „den hellen Schein in ein irdenes Gefäß bekommen“. Unser Gewordensein durch unsere Erziehung, Gesellschaft und unseren Frömmigkeitsstil prägt unseren Glauben. Wir müssen immer auf der Hut sein, nicht von der Wahrheit abzugleiten. Dazu helfen uns die Fragen: Ist das, was ich tue, lebensfördernd? Bin ich bereit, Tabus zu brechen wie Jesus? Was würde Jesus sagen oder tun? Dazu brauchen wir einander.				
95.09	20150909	Rolf Trauernicht	Matthäus 16,13-20	Mt 16,13-20	Wer ist Jesus für mich?	Wenn wir auf der Straße Menschen fragen würden, wer Jesus ist, würden viele sagen: ein guter Mensch, ein Vorbild, der Sohn Gottes oder ein Prophet. Wenn wir persönlich von Herzen sagen können, er ist mein Erlöser, mein Erretter, mein Begleiter und er lebt in mir, dann hat uns der Geist Gottes das offenbart (V.17). Petrus wird mit dieser Erkenntnis der Bedeutung Jesu beauftragt, in der Kraft und Vollmacht Gottes wirksam zu werden. So sind wir es auch. Aber wenn wir verkündigen, dass nur Jesus der Weg, die Wahrheit und das Leben ist, wird es Widerstand geben. Das war zu allen Zeiten so. In dem letzten Vers unseres Abschnittes verbietet Jesus den Jüngern zu bekennen, dass er der Christus sei. Die Zeit war nicht reif dafür. So ist es auch heute. Nicht jede Zeit ist reif für ein Bekenntnis, aber es gibt heilige Momente, in denen wir wissen, jetzt muss ich mich zu Christus stellen, sonst verleugne ich ihn. Petrus hat so einen Moment verpasst mit der Verleugnung Jesu bei der Kreuzigung. In diesem Spannungsfeld zwischen Schweigen und Reden stehen wir auch. Wie wäre es, mit dieser Haltung in den Tag hineinzugehen. Herr, ich will offen sein, von dir zu erzählen oder zu schweigen, führe mich!				
95.09	20150910	Rolf Trauernicht	Matthäus 16,21-28	Mt 16,21-28	Der Weg zum erfüllten Leben	Auf die Frage an Bernd, warum er nicht mehr zur Gemeinde kommt, sagte er, er wolle kein Christ sein, weil er dann die Kontrolle über sein Leben abgeben müsse. Das trifft den Kerngedanken dieses Abschnittes. Jesus kündigt an, dass er sich dem Willen Gottes unterstellen wird und den Leidensweg auf sich nimmt. Petrus tut sich schwer mit diesem Gedanken und wird immer wieder von seinen eigenen Vorstellungen über Nachfolge eingeholt. Jesus ruft seine Jünger und damit auch uns dazu auf, ein Leben der Nachfolge zu führen. Das kann auch Leiden bedeuten. Aber am Ende wird allen offenbar werden, was sinnvoll war. Jedem kritischen Beobachter des Lebens wird auffallen, dass die Menschen, die sich vorwiegend um sich selbst drehen, oft vereinsamen und unglücklich werden. Die Menschen, die sich für andere einsetzen, leben in der Regel glücklicher: Sie entdecken und leben ihre Begabungen und das macht glücklich. Da können wir gespannt sein, wie unser Herr einmal unsere Taten bewertet (V.27). Sie werden uns nicht selig machen, aber eine Bedeutung werden sie haben. Der Anreiz für unsere Nachfolge sollte aber nicht der Lohn, sondern die Dankbarkeit unserem Erlöser gegenüber sein.				
95.09	20150911	Rolf Trauernicht	Matthäus 17,1-13	Mt 17,1-13	Jesus allein	Immer wieder das Gleiche: Die Jünger sehen auf das Sichtbare. Sie wollen Hütten bauen und die Atmosphäre festhalten. Es ist die Offenbarung Gottes, die ihnen mit einer Stimme deutlich macht, dass einzig und allein Jesus zählt, an dem Gott Wohlgefallen hat. Danach sahen sie niemanden, als Jesus allein (V.8). Das ist, was zählt: Alles soll vor Jesus bestehen können, von dort her beantwortet werden und ihn ehren. Das klingt überfromm, aber darin liegt die Erfüllung aller Lebensbereiche. Am Ende unseres Lebens zählen nicht Geld, Ehre, Leistung oder Titel, sondern nur, wie Jesus über uns denkt und wie wir darauf reagieren. Diese genannten Werte sind zwar nicht unwichtig und sie gehören zu unserem Leben dazu, aber sie dürfen unsere Jesusbeziehung nicht überdecken. Sonst besteht die Gefahr, dass sie uns in Beschlag nehmen und unfrei machen. Der kleine Hinweis, dass Jesus die drei Jünger mit auf einen hohen Berg nahm, kann uns dazu anregen, immer wieder mal Abstand vom Alltag zu suchen, um die Nähe Jesu mehr zu erfahren. Ich empfehle, immer mal die Frage mit auf eine Wanderung zu nehmen: Jesus, wie denkst du über mich?				
95.09	20150912	Rolf Trauernicht	Matthäus 17,14-21	Mt 17,14-21	Die Vollmacht der Christen	Merkwürdig, über diesen Text finde ich in meinen zahlreichen Andachtsbüchern und Auslegungen keine Auslegung. Liegt es daran, dass viele Christen so selten das massive Eingreifen Gottes erlebt haben und mit der versprochenen Vollmacht Jesu nichts anfangen können? Da überlesen wir vielleicht gern diesen Text, anstatt enttäuscht zu werden, wenn unsere Gebete nicht so erhört werden, wie wir es wünschen. Aber ich denke, dass diese Vollmacht, die Jesus den Jüngern gab, durch den Glauben an die Macht Gottes, Wunder zu erleben, auch für uns heute noch gültig ist. Nach wie vor ist unser Vertrauen gefordert und dazu sollten wir uns gegenseitig ermutigen. Auf die Frage, warum die Jünger die Geister nicht austreiben konnten, findet sich in späteren Überlieferungen der Hinweis, dass es ihnen an Gebet und Fasten mangelte (vgl. Mk 9,29). Da ist die Frage angebracht: Wann haben wir das letzte Mal uns ganz bewusst zum Gebet und Fasten zurückgezogen, um aus der Nähe mit unserem Herrn Antworten auf ein Anliegen zu bekommen? Das könnte eine Konsequenz auf diesen Text sein. In dieser ging es um das Sichtbare und die dahinterstehende Realität des Reiches Gottes. So auch heute: Bei Gott ist alles möglich.				
50	20150913	Uli Limpf	Psalm 78,32-55	Ps 78,32-55	Lieben wir Gott oder seine Gaben?	Psalm 78 gehört zu den Gebeten, die zu einer echten Umkehr zu Gott aufrufen. Hier macht Asaf eine Rückblende auf die Geschichte Israels mit Gott, als sie noch in Ägypten und bei der Wüstenwanderung waren. Immer nur in der Not wandten sich die Israeliten Gott zu. Doch sobald es ihnen wieder besser ging, vergaßen sie ihn und gingen ihre eigenen Wege (V.34-36). Immer wieder kehrten sie zu ihm um, doch nicht mit Ernst. Ihre Umkehr war nicht aufrichtig. Sie wollten Gottes Schutz, sie wollten Gottes Segen, doch sie wollten nicht ihn selbst. Für den Psalmbeter ist diese Haltung unbegreiflich, denn gerade an Gottes Gerichten über die Ägypter müsste eigentlich deutlich geworden sein, dass man Gott nicht auf die leichte Schulter nehmen kann (V.43 ff.). Dieser Notglaube ist auch heute noch weit verbreitet. Viele beten, wenn es ihnen schlecht geht. Sobald man wieder den Kopf über Wasser hat, geht es auch ohne Gott ganz gut weiter. Wir müssen uns deshalb hinterfragen: Wollen wir Gott oder seine Gaben? Geht es uns um die Gemeinschaft mit ihm oder darum, dass unser Leben problemfrei ist? Gott sehnt sich nach Beziehung zu uns. Gerade deshalb begegnet er uns immer wieder mit seinem Erbarmen (vgl. Ps 103,8 ff.).	Alle eure Sorge werft auf ihn; denn er sorgt für euch.	1. Petrus 5,7		
95.10	20150914	Uli Limpf	Matthäus 17,22-27	Mt 17,22-27	Jesus und das Finanzamt	Die Frage, wer wie viel Steuern zu bezahlen hat, beschäftigt die Menschheit, seit es sie gibt. Auch Jesus wurde mit diesem Thema konfrontiert (vgl. Mt 22,15 ff.). In Kapernaum wollten die Eintreiber der damaligen Kirchensteuer den Betrag auch von Jesus kassieren. In Israel musste jeder Israelit über 20 Jahre einen halben Silberschekel für den Dienst am Tempel beisteuern (2. Mose 30,11-16). In der griechischen Währung, die man zur Zeit Jesu benutzte, war das eine Doppeldrachme - heute wären das ca. 150 Euro. Im Gespräch Jesu mit Petrus macht Jesus deutlich, dass er als Sohn Gottes eigentlich keine Tempelsteuer bezahlen müsste. Auch seine Jünger sind in Jesu Augen Gotteskinder (vgl. Mt 5,16.45.48) und wären damit von der Abgabenpflicht befreit. Petrus soll dennoch die Steuer bezahlen, um den Juden kein Ärgernis zu geben. Damit hatte Jesus eine Grundsatzentscheidung getroffen. Seine Jünger sollen auf Freiheit verzichten, wenn es dem Reich Gottes, der Ausbreitung des Evangeliums dient (vgl. 1. Kor 9,19; Gal 5,13; Röm 14,21). Und überhaupt, um Geld hatte Jesus nie gestritten. Das Wunder, das Petrus dann erlebt, ist ein Zeichen dafür, dass Jesus von seinem himmlischen Vater versorgt wurde. Ein Vertrauen, das auch wir haben dürfen.				
95.10	20150915	Uli Limpf	Matthäus 18,1-9	Mt 18,1-9	Veränderte Prioritäten	Wer unter den Jüngern der Größte ist, war das Lieblingsthema der Jünger Jesu. Immer wieder berichtet das NT, dass es darüber Streitgespräche gab (vgl. Mt 20,20 ff.). Noch im Abendmahlssaal war sich jeder zu gut, den anderen die Füße zu waschen, sodass Jesus selbst diesen Dienst an ihnen tat (Joh 13,1 ff.). Drei Jahre mit Jesus hatten sie nicht davon befreit, selbst etwas sein und darstellen zu wollen. Auch für uns ist es eine lebenslange Versuchung, vor anderen Menschen glänzen zu wollen. Immer wieder ist es nötig, an dieser Stelle umzukehren (V.3). Betrachten wir die Lebenswege der Jünger, merken wir, dass sie im Lauf ihres Lebens diese Lektion gelernt hatten. Aus den Donnersöhnen Jakobus und Johannes wurden Männer, die sich später ganz in den Dienst für andere Menschen stellten (vgl. Offb 1,9). Im zweiten Abschnitt des heutigen Textes geht es darum, dass Jesus davor warnt, die Jesusnachfolge zu verlassen. Mit den „Kleinen, die an mich glauben“ meint er unzweifelhaft die Jünger (Mt 10,42). Die Anfechtungen können von außen kommen - von der Welt, oder aber von innen. Drastisch macht Jesus deutlich, dass das ewige Leben das Wichtigste überhaupt ist. Es ist wichtiger als die Gesundheit und als alles andere auf dieser Welt (V.8.9).				
95.10	20150916	Uli Limpf	Matthäus 18,10-14	Mt 18,10-14	Der Einzelne ist bei Gott wichtig	Oft wurde aus dieser Bibelstelle herausgelesen, dass Kinder einen Schutzengel haben. Deshalb ist es hier wichtig, genau hinzusehen. Noch einmal: Die „Kleinen“ sind hier eine Bezeichnung für die Jünger (vgl. Mt 10,42; Mt 18,6). Jesus will also damit sagen, dass wir als Christen nicht verächtlich über andere Christen denken sollen. Jesus begründet das damit, dass jeder Jünger unter der Obhut eines Engels steht. Deshalb hat auch jeder Christ eine besondere Würde. Dennoch ist die Bibel im Blick auf Schutzengel zurückhaltend. Wir sollen nicht Engel, sondern Gott verehren. Der Gedanke, dass bei Jesus jeder Einzelne wichtig ist, wird auch in dem nachfolgenden Gleichnis betont, das sich ähnlich auch in Lukas 15,4-7 findet. In den bergigen Weidegebieten Israels saß der Hirte oft stundenlang im Schatten und zählte erst abends nach, ob alle Tiere beieinander waren. Fehlte eines, machte er sich garantiert auf den Weg, um es zu finden. So ist Gott auch, er geht jedem Einzelnen von uns nach. Nicht weil ihm das verlorene Schaf wichtiger wäre als alle anderen. Nein, alle sind gleich geliebt. Der Auftrag an die Jünger ist damit klar. Sie sollen liebevoll nachgehen, wenn einer nicht mehr dabei ist (vgl. Gal 6,1). Wen legt uns Gott heute aufs Herz?				
95.10	20150917	Uli Limpf	Matthäus 18,15-20	Mt 18,15-20	Tipps fürs Miteinander einer Gemeinde	Dieser Abschnitt ist die Fortsetzung des gestrigen Abschnitts vom verlorenen Schaf. Was soll eine Gemeinde tun, wenn jemand in offensichtlicher Sünde lebt und sich damit von der Herde entfernt? Einfach so tun, als ob nichts wäre? Alles gleich an die große Glocke hängen? Jesu Worte zeigen einen liebevollen, aber gleichzeitig auch konsequenten Weg auf. Zuerst braucht es ein persönliches Gespräch, dann das seelsorgerliche Gespräch im kleinen Kreis, dann erst ist es eine Angelegenheit der Gemeinde, die nicht zulassen darf, dass jemand sich als Christ bezeichnet, aber Gottes Ordnungen ignoriert (vgl. 1. Kor 5,5; 1. Tim 1,20). Gemeinden tun sich schwer, Gemeindezucht im Sinne Jesu zu üben. Martin Luther hat sogar gesagt, dass er es für unmöglich hält, Gemeinde so zu leben. Dennoch steht Matthäus 18,15-17 im NT. Vers 18 beschreibt das größte Geschenk, das Gemeinde Jesu der Welt geben kann: Vergebung von Schuld im Namen Jesu. Gemeinsam zu beten war neben dem Gebet im stillen Kämmerlein (Mt 6,6) für Jesus ein selbstverständliches Merkmal der Gemeinde. Gewaltig ist die Verheißung, die Jesus auf das gemeinsame Gebet von Christen legt (vgl. Joh 14,13 ff.; Joh 15,7). Deshalb die Frage: Habe ich jemand, mit dem ich zusammen beten kann?				
95.10	20150918	Uli Limpf	Matthäus 18,21-35	Mt 18,21-35	Wie Gott mir, so ich dir	Das Gespräch zwischen Jesus und den Jüngern setzt Petrus mit der Frage fort, wie oft er denn seinem Bruder, also dem Mitchristen, vergeben muss. Die Pharisäer lehrten damals, dass man dem anderen drei Mal vergeben, sollte. So wähnte sich Petrus mit seinem Angebot, siebenmal zu vergeben, auf der sicheren Seite. Jesu Antwort macht deutlich, dass Vergebung grenzenlos ist. 70-mal 7-mal - das ist im Alltag nicht mehr zählbar. Jesus illustriert dies nun an dem Gleichnis vom unbarmherzigen Schuldner. Dieser Schuldner, wohl ein hoher Beamter des Königs, schuldet seinem Herrn ca. 100 Millionen Euro. Als er um Barmherzigkeit fleht, erlässt ihm der König die Strafe und sogar die Schuld - unvorstellbar. Gerade mal eine Stunde später lässt dieser Beamte einen Mann ins Gefängnis werfen, weil er ihm lächerliche 100 Euro schuldet. Das ist genauso unvorstellbar. Ich will nicht vergessen, wie viel Gott mir vergeben hat, und Gott will, dass ich denen vergebe, die an mir schuldig geworden sind. Gottes Vergebung ist sogar daran geknüpft, dass auch ich vergebe (vgl. Mt 6,12.14.15). Vergeben heißt, den anderen aus allen Vorwürfen zu entlassen, die ich ihm bisher gemacht habe. Ich behalte nichts zurück, was ich später wieder einmal vorrechnen könnte.				
