5	20150528	Steffi Pfalzer	1. Mose 24,50-67	1.Mo 24,50-67	Gemischte Gefühle, bewegte Herzen	Gott hat entschieden, und Rebekkas Familie akzeptiert diese Entscheidung. Nur mit dem Zeitplan sind sie noch nicht einverstanden. Für die Familie geht das alles zu schnell. Erstaunlich ist jedoch, dass Rebekka, die nun entscheiden soll, das ganz anders sieht. Sie zögert nicht eine Sekunde und ist bereit, zu folgen und ihrem Ehemann in spe sofort entgegenzugehen. Der Weg ist weit und Rebekka legt die vielen Kilometer sicher mit gemischten Gefühlen zurück. Doch dann endlich ist es soweit: Rebekka und Isaak begegnen sich zum ersten Mal. Auffallend ist, dass die erste Reaktion der zukünftigen Eheleute fast synchron verläuft: Sowohl Isaak als auch Rebekka „heben ihre Augen auf“ (V.63.64), d. h., sie blicken auf und sehen den anderen an, wenngleich Isaaks Augen durch den Schleier nicht vollständig bis zu Rebekka hindurchdringen können. Von der anschließenden Hochzeit wird nur knapp berichtet. Interessant ist jedoch, dass Isaak mit der Wahl seiner Frau nicht nur zufrieden ist, sondern dass er Rebekka sogar „lieb gewinnt“. Wenn das nicht Gnade Gottes ist, der nicht nur Situationen von außen, sondern auch die Herzen der Menschen bewegen und verändern kann! Wo möchte ich heute dafür beten, dass Gott Herzen bewegt und verändert?  				
5	20150529	Steffi Pfalzer	1. Mose 25,19-34	1.Mo 25,19-34	Aus zwei mach vier	Trotz der Verheißung an Abraham und der „im Himmel geschlossenen“ Ehe will sich bei Rebekka und Isaak kein Kindersegen einstellen. Ebenso wie ihre Schwiegermutter Sara ist auch Rebekka unfruchtbar. Doch anders als seine Eltern wendet sich Isaak in seiner Not allein an Gott. 20 Jahre müssen die Eheleute jedoch warten, bis Gott Isaaks Gebet erhört und den beiden Kinder schenkt. Dass etwas anders ist, das merkt Rebekka in ihrer Schwangerschaft sehr schnell, und wieder wendet sie sich zuerst an Gott. Das, was Gott zu sagen hat, ist für die werdenden Eltern jedoch nicht besonders ermutigend: Zwei Kinder werden es sein, aus denen einmal zwei verschiedene Völker hervorgehen werden, und der ältere wird dem jüngeren Bruder dienen. Wie genau diese Umkehrung der Verhältnisse ihren Anfang nehmen wird, das erfahren wir auch schon in den nächsten Versen (V.29-34). Im Gegensatz zu seinem Bruder Esau weiß Jakob die Bedeutung des Erstgeburtsrechts (der größere, meist doppelte Erbteil sowie der Erstgeburtssegen) zu schätzen. Jakob betrügt Esau an dieser Stelle nicht, jedoch nutzt er Isaaks Kurzsichtigkeit schamlos aus. Gott schreibt auch mit fehlbaren Menschen seine Geschichte - was bedeutet das heute für dich?				
6.00	20150530	Steffi Pfalzer	1. Mose 27,1-29	1.Mo 27,1-29	Nachilfe erforderlich!?	Still und heimlich möchte Isaak seinen Lieblingssohn Esau segnen. Segen wird im Alten Testament als Übertragung lebenserhaltender Kraft gesehen, die nicht nur von Gott, sondern auch vom Segnenden selbst ausgeht. Daher war es wichtig, dass der Segnende sich vor der Segnung mit einem guten Essen stärkt. In dreifacher Weise war diese stille und heimliche Segnung Esaus jedoch gar nicht gerechtfertigt. Erstens wusste auch Isaak von der Weissagung Gottes vor der Geburt der beiden Söhne (1. Mose 25,23). Zweitens war Esau sein Erstgeburtsrecht gar nichts wert, sodass er es bereits an seinen Bruder „verkauft“ hatte. Und drittens machte Esau seinen Eltern durch seine Heirat mit Kanaanäerinnen nur Kummer und Sorgen (1. Mose 26,34 f.). Als Rebekka von der bevorstehenden heimlichen Segnung Esaus erfährt, kann sie dies nicht auf sich beruhen lassen und vertrauensvoll in Gottes Hände legen. Sie wird hier zur Handelnden und Jakob gehorcht und führt den Plan aus. Was die Sache an sich betrifft, haben Mutter und Sohn recht, Jakob muss gesegnet werden, doch das WIE ist schlichtweg hinterlistig und falsch. Wo habe ich schon Dinge getan, die nicht richtig waren, nur weil ich Gott nicht vertraut habe und dachte, ihm auf die Sprünge helfen zu müssen?				
68	20150531	Pascal Heberlein	Psalm 111	Ps 111	Ein Freund, ein guter Freund	Was zeichnet für dich eine gute Freundin / einen guten Freund aus? Für mich ist ein Freund ein Mensch, auf den ich mich verlassen kann, dem ich vertrauen und von dem ich mit großer Sicherheit sagen kann, dass er mich nicht genervt bei seinem facebook-Account sperrt bzw. mich links liegen lässt, wenn ich ihn mal zu sehr beanspruche. Ein Freund freut sich, wenn ich in Kontakt mit ihm trete. Und bei einem solchen Freund fällt es mir nicht schwer, voll des Lobes zu sein und Komplimente zu verteilen. Pure Begeisterung! Der Psalmschreiber hat einen solchen Freund (und noch viel mehr) in Gott gefunden. Gott ist treu, beständig, verlässlich, wohlwollend. Doch nicht nur das. Er tut zudem noch großartige Werke, ist gerecht, gnädig und barmherzig. Was ist die logische Konsequenz? Der Psalmist hat Lobpreis in Hülle und Fülle. Schreib doch heute mal deinen eigenen Psalm 111! Was schätzt du an Gott besonders? Wofür kannst du ihn ohne Ende preisen? Und wenn du damit fertig bist, nutze doch diesen Tag auch dafür, deiner (besten) Freundin / deinem (besten) Freund / deiner Partnerin / deinem Partner bewusst ein Kompliment zu machen, indem du ihr/ihm sagst, was du besonders an ihr/ihm schätzt. Probier mal aus, wie gut das tut!	Heilig, heilig, heilig ist der Herr Zebaoth, alle Lande sind seiner Ehre voll!	Jesaja 6,3		
6.01	20150601	Pascal Heberlein	1. Mose 27,30-40	1.Mo 27,30-40	Mehr als Worte	Ein Mensch, der keine Ahnung von der Bibel bzw. dem Glauben hat, wird sich sehr über diese Geschichte wundern. Segen, was ist das? Ein alter Vater sagt ein paar verheißungsvolle Worte zu seinem Sohn. Es ist ja nicht so, dass Isaak seinem jüngeren Sohn Jakob das Erbe ausgezahlt hätte und dieser damit durchgebrannt wäre. Oder dass er ihm all seine Tiere überschrieben hätte und nun nicht mehr vom Vertrag zurücktreten könnte. Warum also verzweifelt Esau so sehr, nur weil er diese Worte nicht erhält? Oder warum gibt Isaak nicht Esau den gleichen Segen in doppelter Ausführung und alles ist gut? Segen bedeutet mehr als ein paar Worte. Segen meint die Zuwendung göttlichen Heilsgutes an Menschen. Aber nicht nur der Gesegnete selbst erlebt bei sich die Auswirkungen, sondern auch dessen Nachkommen, sein Besitz und seine Umwelt können Segen abbekommen. Der Gesegnete wird selbst Ausgangspunkt für den göttlichen Segen. Hinzu kommt, dass es hier um den einen besonderen Segen des Vaters geht. Der ist ein für alle Mal weg, wenn er vergeben ist. Esau, so naiv er mitunter war, war sich dessen bewusst, dass ihm etwas Riesiges entgangen ist. Es ging um mehr als nur ein Ritual oder ein paar Worte.			Ich lasse dich nicht los, wenn du mich nicht segnest.	1. Mose 32,27
6.01	20150602	Pascal Heberlein	1. Mose 27,41 - 28,9	1.Mo 27,41 - 28,9	Familienleben	Ist es nicht schön, das harmonische Familienleben?! Der eine Sohn will den anderen umbringen, woraufhin dieser fliehen muss. Das Verhältnis von Mutter und älterem Sohn (Esau) gleicht eher einem Nichtverhältnis. Und die Ehe der Eltern ist durch die Intrigen und Lügen der Mutter bestimmt. Da soll noch mal einer sagen, dass heute alles viel schlimmer sei als früher! In der vorliegenden biblischen Geschichte merkt man am besten an Esau, dass in der Familie etwas schiefläuft. Da Rebekka von ihrem älteren Sohn nicht viel hält, muss dieser allein bei seinem Vater Zuflucht nehmen. Der Vater, Isaak, ist für Esau der Mittelpunkt des Lebens. Ihm will er alles recht machen. Um seinem Vater zu gefallen, nimmt sich Esau sogar eine Frau, die nicht aus dem Volk der Kanaaniter stammt. Jakob wählt auch eine Frau, die nicht zu diesem Stamm gehört, doch steht Esaus Heiratsbeschluss unmittelbar im Zusammenhang mit dem vermuteten Willen des Vaters. Hier liegt keinerlei Differenzierung oder eigenständiges, vom Vater losgelöstes Handeln vor. Esau ist nach wie vor in einem ungesunden Maß fixiert auf den Vater. Obwohl sich Gott Familie sicherlich so nicht gedacht hat, bleibt er treu.				
6.01	20150603	Pascal Heberlein	1. Mose 28,10-22	1.Mo 28,10-22	Show must go on	Nachdem sich Jakob den Segen von seinem Vater Isaak unrechtmäßig erschlichen hat, zeigt sich nun im nächsten Schritt, dass Segen weit mehr ist als ein paar gute Prophezeiungen. Gott selbst bindet sich an den Segenszuspruch, den Isaak seinem jüngeren Sohn gegeben hat. Er verheißt Jakob Land, viele Nachkommen, segensreiches Charisma, Schutz, Beistand und Treue! More than words ... Und was macht Jakob? In seinem Verhalten wird sein Charakter deutlich: Er hat nicht das Selbstbewusstsein, das eine solche Verheißung rechtfertigen würde. Ein Mensch, der selbstbewusst erzogen wurde, der ein gesundes Verhältnis zu Mutter und Vater hat, der von beiden gleichermaßen geliebt ist, hätte hier vielleicht gesagt: „Gott, mit dir kann ich über Mauern springen!“ Jakob stattdessen glaubt nicht daran, dass er ein solch mächtiger Stammesvater wird. Ihm scheint noch niemals jemand etwas zugetraut zu haben. Jakob denkt nicht so groß von sich, wie Gott von ihm denkt. Er konzentriert sich lieber auf das, was er wirklich braucht: Ihm reichen Bewahrung, Essen, Kleidung und eine friedvolle Rückkehr. Daran hängt er seinen Glauben. Doch Gott sieht viel mehr in Jakob und er weiß, dass der junge Mann dafür geeignet ist. Ihm fehlt nur noch die Herausforderung ...  				
6.01	20150604	Pascal Heberlein	1. Mose 29,1-14a	1.Mo 29,1-14a	Gott ist gut	Weiter geht's in der Gott-hält-sich-an-seinen-Segen-Geschichte! Gerade noch hat er Jakob großen Nachwuchs verheißen, jetzt zeigt er ihm eine geeignete Partnerin. Als Jakob die schöne Rahel sieht, kommt sofort der Gentleman in ihm vor: Er rollt den Stein von der Brunnenöffnung weg, um Rahel das Tränken der Schafe abzunehmen. Völlig überraschend wird erwähnt, dass Jakob zu weinen beginnt. Diese emotionale Seite mag heute nicht mehr so sehr verwundern, für damalige Verhältnisse scheint sie aber schon ... sehr seltsam. Aber dieses Verhalten passt wieder zu dem schwachen und verunsicherten Jakob, der er bis zu dem Kampf mit dem Engel noch sein wird. Der Ausspruch Labans bei der Begegnung der beiden Männer, dass Jakob von seinem Gebein und Fleisch sei, findet sich in alten Adoptionsurkunden und könnte deshalb bedeuten, dass Laban den jungen Mann adoptierte. Dies erscheint logisch, da die Tatsache, dass Rahel die Schafe weidete, dafür spricht, dass Laban ohne Sohn war. Auch hier zeigt sich wieder, dass Gottes Fürsorge weitergeht. Er stellt Jakob in eine neue Familie und lässt ihn nicht allein. Gott ist gut, oder?!				
6.01	20150605	Pascal Heberlein	1. Mose 29,14b-30	1.Mo 29,14b-30	All you need is Love	Laban, der größte Schuft, seit es Verwandte gibt! Angesichts solcher Intrigen wird offensichtlich, dass er mit Rebekka, Jakobs Mutter, verwandt ist. Laban beutet Jakob aus wie einen Sklaven. Erst einmal lässt er ihn einen Monat für sich arbeiten, ohne dass sie irgendeinen Lohn vereinbart haben. Dann akzeptiert er einen völlig überzogenen Brautpreis und lässt sich diesen vor der Vermählung auszahlen. Nach sieben Jahren missachtet er heilige Ordnungen, menschliche Würde und alle natürlichen Gefühle und schiebt Lea dem Jakob unter. Zu guter Letzt lässt er Jakob noch einmal zusätzlich weitere sieben Jahre schuften! Hätte Laban das gleiche Verhalten gegenüber Esau gezeigt, hätte dieser ihn wahrscheinlich erschlagen. Jakob aber lässt alles mit sich machen. Grund dafür kann nicht nur eine völlige Hingezogenheit zu Rahel sein, sondern muss auch wieder in seinem von Selbstzweifeln und geringem Selbstbewusstsein bestimmten Charakter liegen. Für Jakob scheint es selbstverständlich, tatsächlich die sieben weiteren Jahre abzuarbeiten. Er lässt sich schier unendlich ausnutzen, ohne auch nur einen Hauch von heiligem Zorn zu zeigen. Spürst du die Wut, die Jakob eigentlich haben sollte?  				
7.00	20150606	Pascal Heberlein	1. Mose 31,1-7.14-32	1.Mo 31,1-7.14-32	Alles nur geklaut …	Jakob und seine Erbschaften! Seinem eigenen Vater hat er den Segen, der für den Erstgeborenen war, abgeluchst und nun ist er in einem neuen Erbschaftsstreit. Doch hierbei ist er unschuldig. Jakob packt seine Sachen und zieht weg. Nicht zuerst aus Angst, sondern weil Gott es sagt. Rahel und Lea sind mit Jakobs Vorhaben einverstanden und sehen den Reichtum Labans als ihren an. Immerhin hat ihr Vater ihnen nicht, wie es üblich war, einen Teil des Brautpreises zurückgegeben. In diesem Zug nimmt Rahel auch den Hausgott mit. Normalerweise bekam der Haupterbe die Götter des Vaters, sodass der Besitz dieses Objekts rechtliche Vorteile bezüglich des Erbes brachte. Dass Laban deshalb aufgebracht ist, ist verständlich. Doch Gott kümmert sich auch hier um Jakob und seine Familie. Die Aufforderung, die Gott Laban im Traum sagt, bedeutet, dass er auf seine rechtlichen Ansprüche gegenüber Jakob verzichten solle. Gott löst Jakob also aus seinem „Sklavendasein“. Dass Jakob den Tod des Diebes verspricht, zeigt, wie wichtig dieser Hausgott war und wie sehr Jakob seiner Familie vertraute. Mit solchen Versprechungen sollte sehr vorsichtig umgegangen werden. Doch auch hier bewahrt Gott den Jakob, wie zu sehen sein wird.				
62	20150607	Andrea Tschuch	Psalm 106,1-23	Ps 106,1-23	Verbindende Begegnung	Gott ist freundlich und gütig, und er ist treu! Das erkennt der Psalmdichter. Deshalb wagt er es, Gott um Hilfe für sein Volk zu bitten, das ihm immer wieder untreu wird. In der Wüste, auf dem Weg ins verheißene Land geraten sie ständig auf Abwege. Sie proben den Aufstand, machen Mose und Aaron Vorwürfe, lehnen sich gegen Gott auf, sind ungehorsam. Sie bekommen die Konsequenzen ihres Handelns zu spüren, kehren zu Gott um und werden ihm bei nächster Gelegenheit wieder untreu. Sie schrecken noch nicht einmal vor abscheulichem Götzendienst zurück. Gott will sein geliebtes, aber so starrsinniges Volk verlassen, doch Mose tritt für das Volk ein (2. Mose 32). Bis heute lassen sich menschliche Untreue auf der einen und die Treue Gottes auf der anderen Seite beobachten. Menschen werden untreu, weil sie unbeständig sind und ihre Treue manchmal von den Umständen abhängig machen. Gott ist treu, weil sein Wesenszug Treue ist. Damals trat Mose in die Kluft zwischen Gott und seinem Volk (V.23). Jetzt ist Jesus Christus für alle Menschen ein für alle Mal in die Kluft zwischen Gott und Mensch getreten. Er ist die Brücke zu Gott. Wenn wir ihm unsere Sünden bekennen, dürfen wir wissen, dass er uns vergibt (1. Joh 1,9).	Christus spricht zu seinen Jüngern: Wer euch hört, der hört mich; und wer euch verachtet, der verachtet mich.	Lukas 10,16		
7.01	20150608	Andrea Tschuch	1. Mose 31,33-54	1.Mo 31,33-54	Konfliktträchtige Begegnung	Die Geschichte von Jakob und seiner Familie ist eine Geschichte von Irrungen und Wirrungen. Und es ist die Geschichte von einem Gott, der nie den Überblick verliert und auch im größten Chaos seine guten Pläne und Absichten ans Ziel bringt. Wieder mal sieht es ziemlich wüst in Jakobs Leben aus. Mit seiner Familie flieht er aus dem Haus des Schwiegervaters und wird von ihm gestellt (V.20-23). Rahel stiehlt den väterlichen Hausgott (V.19), eine Figur, die als eine Art Schutzgeist im persönlich-familiären Bereich dient. Jakob weiß nicht, dass Rahel die Figur gestohlen hat, und spricht dem, bei dem sich der Hausgott findet, das Todesurteil (V.32). Das hätte auch schiefgehen können. Wieder einmal greift Gott ein. Er begegnet Laban im Traum und verbietet ihm, Jakob etwas Böses zu tun (V.24). Auch die Götterfigur wird nicht gefunden, Rahels List geht auf. Obwohl die Vorzeichen auf Sturm standen, endet die Begegnung zwischen Laban und Jakob friedlich. Die Männer ziehen eine Grenzlinie und verpflichten sich mit einem Bund, diese Grenze einzuhalten. Gottes Geschichte mit Jakob geht weiter. Menschliche Tricksereien, Irrtümer und Fehler haben ihn noch nie am Handeln gehindert.				
7.01	20150609	Andrea Tschuch	1. Mose 32,1-22	1.Mo 32,1-22	Himmlische Begegnung	Während Jakob in seine alte Heimat unterwegs ist, begegnen ihm die Engel Gottes. Damals, als er seine vertraute Umgebung verließ, um der Rache seines Bruders Esau zu entkommen, hatte Jakob auch solch eine himmlische Begegnung. Er sah die Engel auf einer Leiter, die bis zum Himmel reicht. In Bethel hat Gott ihm seinen Schutz zugesagt und ihm versprochen, dass er heil in das Land zurückkommen wird (1. Mose 28,10-15). Damals war er allein, jetzt trägt er Verantwortung für Frauen und Kinder. Die erneute Begegnung mit den Engeln Gottes gibt Jakob Mut, und den kann er gut gebrauchen. Er will sich mit Esau versöhnen. Aber ob der von seinen Racheplänen Abstand genommen hat? Kein Wunder, dass Jakob sich zu Tode fürchtet, als er hört, dass Esau ihm mit vierhundert Mann entgegenkommt. Jakob befürchtet das Schlimmste und trifft entsprechende Vorkehrungen (V.8.9). In seiner Not wendet er sich an Gott und fleht um seinen Beistand (V.10-13). Jakob weiß, dass er ganz und gar von Gott abhängig ist. Trotzdem bereitet er ein großzügiges Geschenk vor, um seinen Bruder zu beschwichtigen. Noch immer ist er auf das Schlimmste gefasst. Aber er ist bereit, sich mit Gottes Hilfe einer schwierigen Begegnung zu stellen. Wo ist es an dir, das auch zu tun?  				
7.01	20150610	Andrea Tschuch	1. Mose 32,23-33	1.Mo 32,23-33	Verändernde Begegnung	Jakob steht an der Schwelle zum verheißenen Land. Seine Familie ist schon auf der anderen Seite des Jabbok. Aber bevor Jakob in das Land kommen kann, muss er kämpfen. Er hat in seinem Leben schon viele Kämpfe ausgetragen und längst nicht alle waren notwendig. Hier ist er gezwungen zu kämpfen, weil er in der Nacht angegriffen wird. Es ist ein langer, entschlossener Kampf, der bis zum Morgen andauert und Jakob verändert. Jakob wird durch einen Schlag auf die Hüfte lahmgelegt. Er kann nicht mehr siegen, aber ihm dämmert, mit wem er kämpft und welche Bedeutung dieser Kampf hat. Er hält entschlossen an Gott fest, um von ihm gesegnet zu werden. Dieser Kampf ist ein Wendepunkt in Jakobs Leben. Aber bevor etwas Neues beginnt, muss Jakob seinen Namen nennen und damit bekennen, wer er bisher war und wie er gelebt hat. Dann wird sein Leben radikal verändert, er bekommt einen neuen Namen. Aus Jakob dem Fersenhalter wird Israel, das bedeutet: Gott kämpft. Gott kämpft mit Jakob, um ihn zu segnen und zum Segen werden zu lassen, und er streitet für Israel (vgl. 2. Mose 14,14). Mir macht diese Geschichte Mut, entschlossen an Gott festzuhalten, seine Verheißungen ernst zu nehmen und mich von ihm segnen und verändern zu lassen.  				
7.01	20150611	Andrea Tschuch	1. Mose 33,1-20	1.Mo 33,1-20	Bewegende Begegnung	Jakob rechnet mit allem, aber nicht damit, dass Esau ihm so herzlich begegnet. Obwohl Jakob durch die Begegnung mit Gott verändert und gestärkt ist, zeigt sich immer noch etwas von der alten Schwäche. Er stellt seine Kinder und Frauen in einer Reihe auf. Die ihm wichtigsten Personen, Rahel und Josef positioniert er hinten auf dem sichersten Platz. Diese strategische Aufstellung ist genauso überflüssig wie das großzügige Geschenk, das Jakob vorausgeschickt hat, um Esau milde zu stimmen. Esau kommt in friedlicher Absicht. Er hat den aufrichtigen Wunsch, sich mit Jakob zu versöhnen. Diesen Wunsch hat Gott selbst in ihm geweckt und Jakob weiß das, deshalb sagt er, dass er im Gesicht Esaus Gottes Gesicht sieht (V.10). Er verneigt sich vor Esau, und als er mit ihm spricht, nennt er Esau „meinen Herrn“ (V.8.13-15). Sich selbst bezeichnet Jakob als Esaus Knecht (V.5.14). Bestimmt steckt hinter diesem Verhalten auch eine gewisse Vorsicht, um den Bruder nicht doch noch unnötig zu reizen. Aber Jakobs Verhalten lässt auch eine Demut erkennen, die vorher nicht da war. Gott hat Jakob verändert und er heilt die völlig zerrüttete Beziehung der Brüder. Jakob kann in Frieden zurückkehren, wie Gott es ihm versprochen hat (1. Mose 28,15).				
8	20150612	Andrea Tschuch	1. Mose 37,1-11	1.Mo 37,1-11	Unangenehme Begegnung	Wie zwischen Esau und Jakob kommt es auch zwischen Josef und seinen Brüdern zu unangenehmen Begegnungen. Josef, er ist ein Sohn Rahels, liegt seinem Vater besonders am Herzen. Josef ist noch jung, als er zusammen mit seinen Halbbrüdern das Vieh des Vaters hütet. Seinem Vater gegenüber ist Josef treu und loyal und erstattet Bericht, was die anderen so treiben, wenn der Vater nicht in der Nähe ist. Damit macht er sich bei seinen Brüdern nicht gerade beliebt. Die Situation spitzt sich zu, als Jakob seinem Lieblingssohn ein besonders schönes, buntes Gewand schenkt. Damit zeigt er deutlich, dass Josef seine erste Wahl ist. Eigentlich sollte Jakob es besser wissen. Schließlich hat er selbst erlebt, welche Konflikte durch elterliche Bevorzugung in einer Familie aufbrechen können ... Gott bestätigt Jakobs Wahl durch zwei Träume und sagt voraus, dass Josef über seine Familie herrschen wird. Warum Josef diese Träume direkt seinen Brüdern erzählen muss, ist fraglich. Vielleicht ist er einfach nur ehrlich. Oder er handelt unklug und unreflektiert. Jedenfalls eskaliert der Konflikt endgültig, die Brüder wollen den verhassten Josef loswerden. Jakob lässt das Gehörte nicht los, er weiß: Jakobs Träume können sehr wohl Gottes Pläne zeigen.  				
8	20150613	Andrea Tschuch	1. Mose 37,12-36	1.Mo 37,12-36	Betrügerische Begegnung	Für die Brüder ergibt sich die Gelegenheit, den verhassten Josef endlich loszuwerden. Sie sind ca. 100 km von zu Hause entfernt und müssen nicht fürchten, dass ihre finsteren Machenschaften ans Licht kommen. Am liebsten würden sie Josef direkt töten, aber Ruben überredet seine Brüder, ihn stattdessen in einen Brunnen zu werfen. Zu der geplanten Rettungsaktion kommt es aber nicht mehr. Josef wird an vorbeiziehende Händler verkauft und landet in Ägypten im Haus des Potifar. Jakob weiß nichts von alldem. Wie er selbst seinen Vater getäuscht hat, um sich den Segen zu erschleichen (1. Mose 27), wird er jetzt von seinen Söhnen getäuscht. Das prächtige Gewand, das den Hass der Brüder angeheizt hatte, dient blutverschmiert als Beweis, dass Josef etwas zugestoßen ist. Wie die Brüder es beabsichtigen, zieht Jakob den Schluss, dass sein Sohn von einem Tier angefallen und getötet wurde. Das Täuschungsmanöver gelingt. Die Hoffnung der Brüder, dass sie Josefs Platz einnehmen können, erfüllt sich nicht. Jakob ist untröstlich. Wie bei seinem Betrug leidet auch bei diesem Betrug die ganze Familie. Das Familienmuster von Lug und Betrug und daraus resultierendem Leid zieht sich durch. Gottes Treue auch: Er betrügt nicht. Was er sagt, tut er auch.  				
63	20150614	Jörg Raddatz	Psalm 106,24-48	Ps 106,24-48	Gottes Werk, widerspenstiger Mensch	Erstaunlich: Unser Text spiegelt die ganze menschliche Tragik von Misstrauen und Kleinglauben gegenüber Gott wider, mit allen Konsequenzen. Trotzdem ist der ganze Psalm eingerahmt durch ein doppeltes „Halleluja!“. Realitätsverlust? Schönfärberei? Nein, hier bricht sich das Staunen über Gottes Treue trotz Israels Untreue Bahn. Das ist realistisch: Das Nachsinnen über Gottes rettende Taten verschließt nicht die Augen vor der eigenen Rettungsbedürftigkeit. Unser Abschnitt steigt bei der kuriosen Szene in der Wüste ein (V.24 f. - es lohnt sich, nachzulesen: 5. Mose 1, besonders V.27 ff.): Das Gelobte Land liegt zum Greifen nah, Gott erneuert durch Mose seine Verheißungen und appelliert an Israels Vertrauen - und die Israeliten verkriechen sich aus lauter Angst vor den „Riesen“ in ihre Zelte. Der weitere Weg Israels ist gekennzeichnet von Kleinglauben, Untreue, Abgötterei, Schuld und Widerspenstigkeit (V.43). Seien wir realistisch: Gottes Rettungshandeln in Jesus öffnet uns die Augen für unsere Lage. Kein Grund also, uns angesichts unserer „Riesen“ und Schuld zu verkriechen, sondern mit einzustimmen ins Halleluja des staunenden Psalmbeters. Wofür oder für wen möchte ich Gott heute ganz konkret um Hilfe bitten (V.47)?	Christus spricht: Kommt her zu mir, alle, die ihr mühselig und beladen seid; ich will euch erquicken.	Matthäus 11,28		
9.00	20150615	Jörg Raddatz	1. Mose 39,1-23	1.Mo 39,1-23	Reifetest - oder: Standhaftigkeit lohnt	Potifars Frau setzt Josef mehrfach und immer aufdringlicher zu. Auch wenn der Autor dieser Geschichte sich wenig über Josefs Gedanken und Gefühle auslässt: Da er kein Roboter war, wird er einen echten Konflikt durchgemacht haben. Warum auch nicht mit einer schönen und mächtigen Frau ins Bett steigen? Warum nicht die schönen Überraschungen des Lebens auskosten, wo sich solche Chancen bieten? Auch wenn die Konsequenzen zunächst bitter sind (wieder Gefängnis, V.20), Josef steht uns hier Modell für Gottvertrauen als Widerstandskraft in Versuchungen. Seine Motivation sind Treue gegenüber seinem Hausherrn und das Bewusstsein für die Sündhaftigkeit seines Tuns, wenn er nachgäbe. Seine Methode sind Hartnäckigkeit in der Sache, Klarheit in der Argumentation und ein aufrichtiges Bekenntnis gegenüber Gott (V.8 f.). Am Ende bleibt nur noch die Flucht nach vorne (V.12). Seine Kraftquelle ist Gott selbst, der Josef hier mit der nötigen Portion Widerstandskraft ausstattet (Rahmen der Geschichte: V.2.23, „der Herr war mit Josef“). Josef ist ein Sklave und Gefangener. Trotzdem strahlt sein Leben innere Freiheit aus. Wo möchte ich heute oder in nächster Zeit mit Gottes Kraft klar Position beziehen in Versuchungen oder Herausforderungen?				
