99.02	20150224	Thomas Maier	Römer 5,6-11	Röm 5,6-11	Der Liebe Gottes und des Heils gewiss	Gottes Liebe lässt sich manchmal mitten in unserem Leben erfahren, aber am klarsten und grundlegend erkennen wir seine Liebe am Kreuz Jesu. Als Gott für uns noch Luft war und wir an ihm vorbeilebten, da hat er sich schon für uns hingegeben. Was bei Menschen selten oder nie vorkommt (V.7), das tut Gott. Er lässt in Jesus sein Leben für uns, weil er uns liebt, weil er sich nach uns sehnt, weil er nicht ohne uns sein will. Aber weil er auf uns als Sünder trifft, darum schafft er in Christus Heil für uns, und zwar so, dass wir mit ihm zusammen sein können: Wo wir uns als verlorene Sünder, die weder Gott noch unseren Nächsten von Herzen lieben können, erkennen und an uns verzweifeln, da ergreifen wir Christus - seine Gerechtigkeit ist die meine; meine Sünde hat er auf sich genommen. In ihm sind wir schon jetzt vor Gott gerechtfertigt und mit Gott versöhnt. Und darum ist es gewiss, dass wir auch im Letzten Gericht gerettet werden, d. h., nichts wird diese heilvolle Gemeinschaft mehr zerstören können (vgl. Röm 8,31 ff.). In dieser Gewissheit des Glaubens zu leben ist entlastend - das ist einfach schön, nicht mehr bangen zu müssen, wie es am Ende ausgehen wird. Freuen wir uns doch an Christus als unserem Heil!				
99.02	20150225	Thomas Maier	Römer 5,12-21	Röm 5,12-21	Christus will das Leben	Wie gut, dass Christus stärker ist als alles Unheil und alle Sünde. Adam und Christus werden miteinander verglichen. Sie gleichen sich darin, dass sie für alle Menschen Bedeutung haben. Sie unterscheiden sich aber in dem, was sie bringen: Adam Sünde und Tod, Christus hingegen Heil und Leben. Die Sünde ist einerseits ein Verhängnis, das alle betrifft; andererseits willigt jeder ein und sündigt selbst (V.12). So erleben wir das bis heute. Die Sünde bestimmt auch die Menschen, die Gottes Gesetz, wie es im AT gegeben ist, nicht kennen; dennoch sind sie schicksalhaft im Bösen verstrickt. Davon erahnen wir als Christen noch etwas, wenn wir zur Sünde versucht werden. Gut, dass Christus bereits jetzt diejenigen bestimmt, die ihn im Glauben empfangen haben (V.17). In ihm sind wir gerechtfertigt und zum Leben bestimmt: Gott will unser Leben. Gnade meint Vergebung der Sünde und noch viel mehr: Gerechtigkeit und Leben! Christus bezieht uns in die Erlösung und Erneuerung der ganzen Welt ein. Was für eine Berufung: Wir sind Teil der heilsamen Herrschaft Gottes. Halten wir es Gott hin, wo in unserer Lebensgeschichte, oder in der von anderen, Sünde Leben verhindert oder zerstört - und bitten ihn um Heilung und suchen hilfreiche Seelsorge.				
99.02	20150226	Thomas Maier	Römer 6,1-11	Röm 6,1-11	In und durch Christus befreit leben	Gottes Gnade: Vergebung und ein neues Leben! Jesus belässt uns nicht in der Sünde. Wir sind mit ihm ganz verbunden, mit ihm gestorben als Sünder am Kreuz. Was mit ihm geschehen ist, ist mit uns geschehen. Und können wir uns vorstellen, dass Jesus sündigt? Nein. Wir werden zwar immer wieder versucht, zu sündigen. Lassen wir uns aber dadurch nicht irritieren: Der alte Mensch lebt noch in uns, aber der neue Mensch wird dadurch nicht infrage gestellt. Im Gegenteil: Wer glaubt, erlebt Versuchung, selbst Jesus ist versucht worden. Aber: Wir gehören nicht mehr der Sünde, sondern ganz Gott. Wir sind zur Freiheit von der Sünde berufen, um als Befreite ganz für Gott zu leben. Es gibt nichts Schöneres, als wirklich zu lieben und zu vertrauen. Darin immer mehr zu wachsen und Gott in seinem Reich zu dienen, dazu sind wir berufen. Es geht um mehr, als einfach nur um Glauben und darum, in den Himmel zu kommen. Bereits jetzt geht es Jesus darum, uns Schritt für Schritt in sein Bild zu verwandeln. Wo wir Gott täglich dafür danken, wer wir in Jesus sind, uns unserer Identität in Christus vergewissern, uns also dafürhalten (V.11), da werden wir auch entsprechend leben wollen, da wollen wir gemäß dem leben, was wir in Jesus bereits sind.				
99.02	20150227	Thomas Maier	Römer 6,12-23	Röm 6,12-23	Gutes erkennen und tun	Seid klar im Blick auf die Sünde: Habt nichts mit ihr zu tun! Seid ganz entschieden auf der Seite des Lebens, der Gerechtigkeit und des Guten. Führt euch vor Augen, wie Sünde Leben zerstört, wie sie euch selbst unfrei macht. Könnt ihr das noch wollen? Nicht wirklich, oder? Führt euch vor Augen, wie Leben aufblüht, wo Menschen das Gute tun, wo sie fähig sind, zu lieben, und zu tun, was zum Leben hilft. Gerechtigkeit meint das heilsame Miteinander, das von Gottes Willen her gelebt wird, wo jedem das zukommt, was er zum Leben braucht, wo Menschen in die Gemeinschaft einbezogen werden, die sonst ausgeschlossen sind. Es geht um ganze Hingabe an Gott! Stell dir vor, wie schön es ist, am Abend eines Tages zurückzuschauen und sich am Guten zu freuen, das du und andere gelebt haben. Noch einmal: Unterschiedlichste Begierden, die Neigung zum Bösen lebt auch noch in uns als Christen, aber wir sind der Sünde nicht mehr ausgeliefert. In Jesus sind wir dazu berufen, Sünde zu beherrschen. Das gelingt dort, wo wir nicht nur gegen die Sünde ankämpfen und dem Bösen in jeder Gestalt absagen, sondern uns ganz Gott zur Verfügung stellen, uns von ganzem Herzen auf das Gute ausrichten und es tun, täglich - es kommt darauf an, es Tag für Tag einzuüben.				
99.02	20150228	Thomas Maier	Römer 7,1-6	Röm 7,1-6	Befreit zur Furcht für Gott	Das Gesetz im Sinne des AT sagt, was wir tun sollen. Dabei machen wir zwei Erfahrungen: Indem es sagt, du sollst das tun und jenes lassen, erkennen wir uns als solche, die das Gebotene unterlassen oder übertreten. Da stellt das Gesetz fest: Wir sind schuldig (vgl. 3,20). Andererseits erkennen wir, dass das Gesetz keine Kraft gibt, das von ihm Gebotene zu tun. Darin liegt die Grenze des Gesetzes: Es verändert uns nicht und es hilft nicht, von seinem Todesurteil frei zu werden. In Christus sind wir von beidem befreit: Zum einen sind wir durch ihn versöhnt mit Gott und also wirklich befreit vom Todesurteil des Gesetzes. Zum anderen sind wir mit ihm als der Kraft verbunden, die neues Leben in uns schafft. Sein Geist wohnt in uns. Das Beispiel aus dem Eherecht in den Versen 2-4 zeigt, dass wir als solche, die mit Christus verbunden sind, auch mit ihm gestorben sind. Deshalb sind wir nicht mehr unter dem Gesetz. Insofern gilt: Jetzt leben wir das Gute und bringen auf diese Weise Frucht für Gott. Es geht also bei der Freiheit vom Gesetz nicht darum, dass wir Gottes Willen nicht mehr tun müssten. Wir sind vom Fluch, den das Gesetz zu Recht über uns bringt, befreit. Und zwar dazu befreit, Gottes Willen konkret zu erkennen und zu leben.				
22	20150301	Johannes Berthold	Psalm 10	Ps 10	Nicht Rache, sondern Recht	Psalm 10 ist ein Klagepsalm - und in manchen Aussagen ein Rachepsalm. So heißt es in Vers 15: „Zerbrich den Arm des Gottlosen und Bösen und suche seine Bosheit heim, dass man nichts mehr davon finde.“ Manchmal wird gerade an solchen Stellen der Abstand zwischen den beiden Testamenten betont. Hier werde gegen die Feinde gebetet, Jesus aber betete am Kreuz für seine Feinde; hier gehe es um Vergeltung, dort um Versöhnung. Auch wenn eine solche Stimme unsere christlichen Ohren stört, müssen wir ihren Klang aushalten. Es ist ja die Stimme eines Opfers! Auch das bekannte Entführungsopfer Jan Philipp Reemtsma erklärte, dass das Opfer einer Gewalttat ein Recht auf Bestrafung des Täters habe. In diesem Sinne ist unser Psalm ein Schrei nach Recht, nicht nach Rache. Und weil der Beter keine irdische Instanz mehr kennt, die sein Recht vertritt, so bestürmt er den Himmel, dass Gott die durch das Unrecht gestörte Welt wieder „zu Recht“ bringen möge. Und die Feindesliebe? Feindesliebe setzt zunächst voraus, dass es Feinde gibt. Sie beschönigt nichts, deckt auch nicht einfach das Unrecht zu. Und doch geht es ihr nicht allein um Recht, sondern um Versöhnung. Versöhnung aber heißt, den Feind nicht zu besiegen, sondern zu gewinnen.	Gott aber erweist seine Liebe zu uns darin, dass Christus für uns gestorben ist, als wir noch Sünder waren.	Römer 5,8	Ist Gott für uns, wer kann wider uns sein?	Römer 8,31
99.03	20150302	Johannes Berthold	Römer 7,7-13	Röm 7,7-13	Spieglein, Spieglein …	Ein Spiegel ist ein nützlicher Gegenstand. Wenn es ihn nicht schon gäbe, müsste man ihn erfinden. So mancher Streit mit unseren Kindern um das abendliche Waschen klärte sich ganz schnell beim Blick in den Spiegel. Nun ist der Spiegel nicht schuld, wenn wir schmutzig sind. Er zeigt uns nur den Schmutz. Es wäre töricht, ihn um dieser Wahrheit willen zu beschimpfen oder gar zu meiden - ein Problem vieler Menschen, wie der Verhaltensforscher Konrad Lorenz meinte: „Sie vermeiden jede Möglichkeit der Selbstbesinnung und Einkehr mit ängstlicher Beflissenheit, als fürchteten sie, dass die Reflexion ihnen ein geradezu grässliches Selbstbildnis entgegenhalte.“ Für Paulus ist auch das Gesetz wie ein Spiegel. Wir brauchen diesen Spiegel - doch nicht zum Schönheitswettbewerb, sondern zur Selbsterkenntnis. Wenn wir beim Blick in diesen Spiegel erschrecken, dann liegt das nicht an Gottes Gesetz, denn es ist „heilig, gerecht und gut“. Nur mutet es uns zu, ehrlich zu uns selbst zu sein. Solche Ehrlichkeit tut weh und kränkt unseren Stolz. Doch brauchen wir uns nicht zu fürchten, denn wir sehen nicht nur unser Selbstbild, sondern auf Christus. In seinen Augen sind wir gut aufgehoben - besser als in unseren eigenen.				
99.03	20150303	Johannes Berthold	Römer 7,14-25	Röm 7,14-25	Der heilsame Riss	Die Selbstanalyse des Apostels klingt deprimierend: „Denn ich weiß, dass in mir, das heißt in meinem Fleisch, nichts Gutes wohnt.“ Zum Glück redet er nicht über andere, sondern sich selbst. Und gerade dazu gehört viel Mut. Denn eher als die eigenen Fehler sieht man doch die der anderen. Doch auch im Umgang mit sich selbst ist es nicht gut, wenn das innere Gespräch immer nur in Enttäuschung endet. Nicht allein Paulus spürt den Riss durch die eigene Existenz. In seinem Buch „Meßmers Gedanken“ legt Martin Walser der Hauptgestalt folgende Worte in den Mund: „Ich habe mich immer so gespannt bewacht wie jetzt. Ich habe immer auf etwas gewartet. Ich weiß nicht, wie diese Erwartung entstanden ist ... Sicher ist auch, dass ich niemandem vorwerfen kann, mir diese Erwartung eingeimpft zu haben. Sie war da, als ich zum ersten Mal ICH sagte. Ich kenne mich nicht ohne diese Erwartung. Ich bin diese Erwartung. Also bin ich auch diese Enttäuschung.“ (Meßmers Gedanken, Frankfurt/M., 1985, 70) Paulus kann über seine Enttäuschung nur sprechen, weil unter ihm ein Netz gespannt ist - Jesus Christus. Die radikale Selbsterkenntnis hält er nur angesichts der radikalen Gnade aus, durch die ihm der so schmerzhafte Riss zum „heilsamen Riss“ (Luther) wird.				
99.03	20150304	Johannes Berthold	Römer 8,1-11	Röm 8,1-11	Gott sandte seinen Sohn	Der mittelalterliche Theologe Anselm von Canterbury fragte einmal tief erschüttert: „Weißt du nicht, wie schwer die Sünde wiegt?“ Ein moralischer Sündenbegriff reichte ihm nicht, um unsere Not zu beschreiben. Die Sünde — so wusste er - besteht nicht nur aus unseren Handlungen, sie prägt unsere ganze Existenz! Dass wir Dinge wollen oder tun, deren Torheit offen zutage liegt; dass wir Abgründe in uns spüren, die uns zurückschrecken lassen; und dass selbst in unserem besten Streben das Böse wohnen kann: Aus diesem Gefängnis „der Sünde und des Todes“ können wir uns nicht selbst befreien. Nur Gott. Genau deshalb wurde Gott Mensch, meinte Anselm. Auch für Paulus besteht das Wunder unserer Erlösung allein darin, dass „Gott seinen Sohn sandte“. Auch für ihn hängt alles davon ab, dass in Jesus Christus uns wirklich Gott selbst begegnet. Das Gefängnis musste von außen geöffnet werden. In Christus „verdammte Gott die Sünde im Fleisch“. In ihm nahm Gott selbst die Konsequenzen unseres verkehrten Lebens auf sich, trägt er alles Menschenleid und alle Menschenschuld. In ihm nimmt er selbst den bitteren Kelch, doch uns reicht er den Kelch des Heils, gefüllt mit Wein - dem Getränk des Festes und der Freude.				
99.03	20150305	Johannes Berthold	Römer 8,12-17	Röm 8,12-17	Wir sind Gottes Kinder	Der Apostel Paulus schreibt in seinen Briefen viel Wichtiges über das Wirken des Heiligen Geistes. Eine der schönsten Aussagen aber findet sich in unserem Text: „Der Geist selbst gibt Zeugnis unserm Geist, dass wir Gottes Kinder sind.“ Der Mensch - ein winziges Staubkorn im Weltall - ein Kind Gottes! Das ist ein Wort von Hoheit und Würde! Das ist der geöffnete Himmel über uns und ein Gott, zu dem wir sagen dürfen: „Abba, lieber Vater!“ - so wie ein Kind in Israel seinen Vater rief. Die Psychologie hat uns gelehrt, dass wir ein Unterbewusstsein haben. Hier aber wird uns ein Oberbewusstsein zugesprochen! Was sich damit ändert? Viel - nein alles! Wir wissen plötzlich, dass wir keine Produkte des Zufalls sind. Wir wissen, woher wir kommen und worin der Sinn unseres Lebens besteht. Und wir wissen auch, dass unser Leben ein Ziel hat. Denn wen Gott liebt, den lässt er bis in alle Ewigkeit nicht los, dem gibt er Teil an seiner Herrlichkeit. Aus dem Alten Testament wissen wir, dass der fromme Jude beim Beten die wichtigsten Gebote an den Kopf und an den Arm binden sollte, damit es sein Denken und Tun erfüllt. Wir sollten es ihm im Geiste nachtun, damit dieser Zuspruch unser Denken und Tun erfüllt: Ich bin Gottes geliebtes Kind.				
99.03	20150306	Johannes Berthold	Römer 8,18-25	Röm 8,18-25	Hoffen im Geist	„Warum leide ich? Das ist der Fels des Atheismus“, sagt Georg Büchner in „Dantons Tod“. Hier geht es bei der Frage nach dem Leid nicht nur um Gottes Allmacht und Liebe, sondern um seine Existenz überhaupt. Wie lässt sich das, was auch nur eine einzige Tagesschau an Leid vor Augen führt, mit dem in Einklang bringen, was die Bibel über Gottes Barmherzigkeit bezeugt? Paulus stellt dieser Frage nach dem Leid die Gewissheit entgegen, „dass dieser Zeit Leiden nicht ins Gewicht fallen gegenüber der Herrlichkeit, die an uns offenbart werden soll“. Er will damit das Leid nicht erklären, noch will er es bagatellisieren. Ihm ist der Perspektivwechsel wichtig, zu dem uns schon Christus im Vaterunser einlädt: „Denn dein ist das Reich und die Kraft und die Herrlichkeit in Ewigkeit.“ Erstaunlich ist der weite Raum der Hoffnung, die nicht nur den Menschen, sondern die gesamte Schöpfung einschließt. Solche Hoffnung lässt uns die Welt mit neuen Augen sehen. Und sie lässt uns glauben, „dass Gott aus allem, auch aus dem Bösesten, Gutes entstehen lassen kann und will. Dafür braucht er Menschen, die sich alle Dinge zum Besten dienen lassen ... In solchem Glauben müsste alle Angst vor der Zukunft überwunden sein“ (Dietrich Bonhoeffer).				
99.03	20150307	Johannes Berthold	Römer 8,26-30	Röm 8,26-30	Vertrauensvoll beten	Paulus spricht hier von einer tiefen Not: „Wir wissen nicht, was wir beten sollen, wie sich's gebührt.“ Wir können zwar „plappern wie die Heiden“ oder auch sorgfältig formulierte Worte wählen wie die Frommen - doch ist das beten? Ist nicht unsere Sprache zu arm und unser Denken zu schwach, um sich dem unaussprechlichen und unbegreiflichen Gott zu nähern? Unser Problem heute ist weniger die Größe, sondern die Ferne Gottes. Bertolt Brecht lässt in seinem Stück „Das Leben des Galileo Galilei“ einen kleinen Mönch folgende Worte sagen: „Es liegt also kein Auge auf uns. Wir müssen nach uns selbst sehen.“ Der kleine Mönch fühlt sich einsam in einem kalten, schweigenden Weltall, das die Erde zu einem winzigen Staubkorn gemacht hat. Kein Ohr, das ihn hört, kein Herz, das ihn liebt, kein Auge, das seine Wege sieht. So muss er mit sich selbst reden, sich selbst lieben, nach sich selbst sehen. Doch Gottes Geist hilft unserer Schwachheit auf - sei es unserer Verzagtheit, sei es unserer Einsamkeit! Er „vertritt“ uns und öffnet uns vertrauensvoll für Gottes Wirklichkeit. Mag das Weltall sich weit über uns spannen - Gott ist uns nah! In dieser Gewissheit meinte einmal Mutter Teresa: „Der Mensch ist von Gott nie weiter entfernt als ein Gebet.“				
33	20150308	Hermann Traub	Psalm 34	Ps 34	Spannungen aushalten durch Lob Gottes	Kann man solch einen Psalm wirklich auslegen? Muss man ihn nicht einfach beten oder singen? Besser noch: Teile dieses herrlichen Lobliedes sollten sich wirklich auswendig in unserem Herzen befinden! Denn Gottes Güte kann man schmecken und fühlen. Man kann sie sehen! Das gute Frühstücksbrot auf unserm Teller, der duftende Kaffee - da fängt es schon an, dass wir Gottes Güte schmecken und sehen können. Doch damit ist noch nicht ausgelotet, was alles lobens- und dankenswert ist. Gott errettet von Furcht! Gibt es nicht tausend Gründe, sich heute zu fürchten? Ganz persönliche, wie Krankheit und Unglück. Die Furcht vor Hiobsbotschaften in unserem Leben kann uns lähmen. Gott rettet aus Elend! Das größte Elend ist, dass wir fern von ihm unser Leben leben, dass wir schamrot werden könnten, wenn wir auf unsere „Trennungszeiten“ von Gott schauen (V.6). Gott rettet aus allen Mangelerscheinungen (V.10). Wer ihn fürchtet, kommt nicht zu kurz. Im zweiten Teil dieses herrlichen Liedes kommen plötzlich die ins Spiel, die Gegner derer sind, die auf Gott vertrauen, die ihn loben. Das ganze realistische Leben mit allen seinen Spannungen wird auf den Tisch gelegt. Dies auszuhalten gelingt, wenn wir nicht aufhören, Gott zu loben. Jetzt ist die Zeit!	Wer seine Hand an den Pflug legt und sieht zurück, der ist nicht geschickt für das Reich Gottes.	Lukas 9,62		
99.04	20150309	Hermann Traub	Römer 8,31-39	Röm 8,31-39	Gewissheit - höchst notwendig	Leben mit Gott steht in vielen Gefahren. Gegenwind, Gegenkräfte, Gegner machen sich auf, um unsere Glaubensgewissheit zu durchlöchern. Aber da steht Jesus. Ihn hat Gott ins Kreuzfeuer geschickt. Ihn hat Gott nicht verschont, damit er uns schonen kann. Ihn hat er dahingegeben, sodass wir im Gegenwind des Lebens und der Zeit nicht kaputtgehen. Unser Glaube soll standhaft bleiben. Deshalb steht er für uns. Und da treten plötzlich Ankläger auf. Ja, wir haben viel falsch gemacht, wir haben Schuld auf uns geladen. Wir haben uns von Gott getrennt. Wer auf der Anklagebank sitzt, der braucht einen guten Anwalt, der sich vor ihn stellt und ihn heraushaut aus dem Schlamassel. Jesus ist der beste Anwalt. Auch wenn uns unser Gewissen verklagt und verdammt: Er verdammt uns nicht. Er vertritt uns und lässt uns nicht fallen. Was ist der letzte Grund von Verunsicherung? Dass wir den Glauben verlieren, dass wir uns trennen von Jesus. Aber gerade da gilt uns die unglaubliche und doch so reale Zusage: Niemand kann uns von der Liebe Gottes trennen. Jesus garantiert für unsere Gewissheit, dass wir für immer zu ihm gehören. Wie wichtig ist diese Gewissheit heute, wo uns so viel abbringen will von ihm! Nicht wir halten dabei durch. Jesus hält uns fest.				
99.04	20150310	Hermann Traub	Römer 9,1-5	Röm 9,1-5	Hast du Schmerzen?	Paulus hat Schmerzen. Es tut ihm weh, dass sein Volk, Israel, sich weithin verschließt, den Messias Jesus anzunehmen. Wenn es etwas nützte, würde er seine eigene Rettung durch Jesus drangeben, dass sein Volk Jesus annimmt. So vieles verbindet ihn und uns mit dem erwählten Volk Israel: Sie sind Gottes Kinder, Gott hat viele Bundesschlüsse mit ihnen gemacht. Jesus kommt mitten aus dem Volk Israel. Was passiert heute in weiten Teilen der Christenheit? Christen lehnen es ab, dass Juden missioniert werden können und Jesus als ihren Messias annehmen. Kleine Gemeinden messianischer Juden dürfen beim Kirchentag nicht ihren Glauben darstellen. Es schmerzt ganz wenige, dass die meisten Juden in der Welt ihren Messias (noch) nicht angenommen haben. Wahrscheinlich sind es die gleichen „Christen“, die es auch nicht schmerzt, dass viele Nichtchristen nicht zu Jesus finden. Ganz anders Paulus: Er steht zu seinem jüdischen Volk, er leidet unsäglich an ihrem Unglauben. Er setzt alles für sie ein, damit sie ihren Messias erkennen. Von dieser Leidenschaft möchte ich lernen: dass es mich schmerzt, wenn Freunde und Verwandte Jesus nicht kennen. Ich will den Mut haben, ihnen Jesus zu bringen! Gelegenheiten gibt es genug dafür. Ich will sie nützen.				
99.04	20150311	Hermann Traub	Römer 9,6-13	Röm 9,6-13	Nimm dein Leben Gott nicht weg!	Rätselhaft ist dieser Text beim ersten Lesen. Das Schlüsselwort aber ist das Wort „Gnade“. Die erwählten Kinder - sowohl bei Abraham (Isaak) als auch bei Isaak (Jakob) - sind nicht wegen ihrer Leistungen als die Segensträger des Planes Gottes erwählt. Noch als sie im Mutterleib waren, hat Gott beschlossen, sie zu berufen. Es ist seine souveräne Entscheidung, seine unverdiente Güte, die sie zu wichtigen Segensträgern Gottes gemacht hat, nicht ihre menschliche oder gar geistige Qualität. Gott beruft seine Zeugen. Es ist pure Gnade, dass er das tut! Und wir haben keine Möglichkeit, seine Entscheidungen anzufechten. Auch heute ruft Gott bestimmte Menschen zu besondern Diensten und Herausforderungen. Diese Menschen stehen unter „der Gnade des Berufenden“! Da haben wir nichts zu meckern. Wir können nur staunen, was Gott aus Frauen und Männern in unserer Zeit für seine Arbeit und Rettungsaktion macht. Und wir können offen sein für seinen Ruf! Im Neuen Testament aber entsteht Jesu neues Prinzip. Was in Israel Einzelnen wie Isaak oder Josef galt, das gilt jetzt allen Christen: Geht hin in alle Welt. Und zwar alle! Und zu jedem bringt Jesus! Er will uns alle zu seinen Segensträgern machen. Keiner soll sich verstecken. Alle gehen!				
99.04	20150312	Hermann Traub	Römer 9,14-29	Röm 9,14-29	Was hat Vorrang im Glauben?	Was hat Vorrang, wenn wir glauben? Unser Wille? Unser Engagement? Unser Glaube? Paulus stellt ein für alle Mal klar: Vorrang hat Gottes Erbarmen. Manche rätseln ein ganzes Leben lang, ob sie von Gott angenommen oder von Gott verworfen sind. Dieses Rätsel ist längst aufgelöst: Gott will in seinem übergroßen Erbarmen alle Menschen zu sich ziehen. Und wenn nun jemand wie Pharao sich Gottes Willen entzieht, so bleibt Gott auch noch in dessen Verstockung der souveräne Herr, der seine Macht über die des Pharao stellt. Trotzdem bleiben Rätsel, die wir nicht lösen: Haben wir überhaupt eine Chance von freier Entscheidung (V.19 ff.)? Ja, wir können uns demütig unter Gottes Willen beugen und ihm vertrauen, dass er der „Meister“ ist. Er hat den Überblick und er will, dass sein „Hauptwille“ sich durchsetzt: Juden und Heiden, Menschen aller Nationen (V.24) hat er dazu berufen, zu ihm zu gehören. Alle Heiden haben die Einladung, zum lebendigen Gott umzukehren, ihm zu folgen und zu dienen. Dies hat immer Vorrang vor dem Gericht Gottes. Und unser Ja oder Nein ist zwar wichtig, aber entscheiden tut Gottes Gnade, dass wir ihm gehören sollen. Und dieser unverdienten Liebe können wir vertrauen, ohne ständige Angst, dass wir verworfen sein könnten. 				
99.04	20150313	Hermann Traub	Römer 9,30 - 10,4	Röm 9,30 - 10,4	Worauf verlässt du dich?	Zwei Wege scheint es zu Gott zu geben: Der Weg, durch mein Tun, meine Werke, mein Engagement vor Gott gut dastehen zu wollen. Viele aus dem jüdischen Volk haben dies mit aller Ernsthaftigkeit versucht. Sie wollten sich ihre Anerkennung von Gott verdienen. Sie wollten es ihm recht machen. Das klingt doch sehr ernsthaft - und viele haben mit vollem Ernst Gott gedient. Es soll mir niemand sagen, dass auch dies heute nicht unsere Gefahr ist: Gott und die Mitmenschen von unserem „Gutmenschentum“ zu überzeugen. Aber die Konsequenz ist: Wir „stoßen“ uns an dem Eckstein, dem „Stolperstein“ auf diesem „Gutmenschenweg“. Wir verwerfen ihn. Wir brauchen Jesus nicht, der uns allein die Gerechtigkeit von Gott schenken kann. Wir wollen unseren Beitrag zu unserer Rettung vor Gott bringen! Und damit verlieren wir Jesus ganz. Denn Jesus füllt nicht nur unsere „Defizitlöcher“. Jesus rettet uns ganz und gar. Ohne ihn haben wir keine Chance, vor Gott zu stehen und ihm zu gehören. Denn Christus ist das Ende der Selbsterlösung und des Gesetzes (V.4). Wer ihm allein vertraut, ist vor Gott richtig. Paulus hätte nichts lieber, als dass seine jüdischen Glaubensgenossen sich allein auf Jesus verlassen. Und diese Hoffnung geht heute bei vielen in Erfüllung.				
